{"componentChunkName":"component---src-pages-job-senior-mlops-training-pipeline-engineer-mdx","path":"/job/senior-mlops-training-pipeline-engineer","result":{"data":{"mdx":{"id":"f139fd8c-d6ff-57aa-bd91-02f4db8ef124","excerpt":"The future is already here, it's just not evenly distributed... join us and let's change that. Let's make\nVoice AI available to everyone andâ€¦","body":"var _excluded = [\"components\"];\n\nvar _templateObject;\n\nfunction _extends() { _extends = Object.assign || function (target) { for (var i = 1; i < arguments.length; i++) { var source = arguments[i]; for (var key in source) { if (Object.prototype.hasOwnProperty.call(source, key)) { target[key] = source[key]; } } } return target; }; return _extends.apply(this, arguments); }\n\nfunction _objectWithoutProperties(source, excluded) { if (source == null) return {}; var target = _objectWithoutPropertiesLoose(source, excluded); var key, i; if (Object.getOwnPropertySymbols) { var sourceSymbolKeys = Object.getOwnPropertySymbols(source); for (i = 0; i < sourceSymbolKeys.length; i++) { key = sourceSymbolKeys[i]; if (excluded.indexOf(key) >= 0) continue; if (!Object.prototype.propertyIsEnumerable.call(source, key)) continue; target[key] = source[key]; } } return target; }\n\nfunction _objectWithoutPropertiesLoose(source, excluded) { if (source == null) return {}; var target = {}; var sourceKeys = Object.keys(source); var key, i; for (i = 0; i < sourceKeys.length; i++) { key = sourceKeys[i]; if (excluded.indexOf(key) >= 0) continue; target[key] = source[key]; } return target; }\n\nfunction _taggedTemplateLiteral(strings, raw) { if (!raw) { raw = strings.slice(0); } return Object.freeze(Object.defineProperties(strings, { raw: { value: Object.freeze(raw) } })); }\n\n/* @jsxRuntime classic */\n\n/* @jsx mdx */\nvar pageQuery = graphql(_templateObject || (_templateObject = _taggedTemplateLiteral([\"\\n  query($fileAbsolutePath: String) {\\n    ...SidebarPageFragment\\n  }\\n\"])));\nvar _frontmatter = {\n  \"title\": \"Senior MLOps Training Pipeline Engineer\",\n  \"name\": \"Coqui\",\n  \"picture\": \"https://avatars.githubusercontent.com/u/75583352?s=400&u=9640c480b84c161c8976d1ebbf2ec3f803f9d82e&v=4\",\n  \"date\": \"March 23, 2022\"\n};\nvar layoutProps = {\n  pageQuery: pageQuery,\n  _frontmatter: _frontmatter\n};\nvar MDXLayout = \"wrapper\";\nreturn function MDXContent(_ref) {\n  var components = _ref.components,\n      props = _objectWithoutProperties(_ref, _excluded);\n\n  return mdx(MDXLayout, _extends({}, layoutProps, props, {\n    components: components,\n    mdxType: \"MDXLayout\"\n  }), mdx(\"p\", null, \"The future is already here, it\\u2019s just not evenly distributed\\u2026 join us and let\\u2019s change that. Let\\u2019s make\\nVoice AI available to everyone and in every language!\"), mdx(\"p\", null, \"Are you looking for something completely new, the chance to build \\u201Cfrom the ground-up\\u201D an MLOps training pipeline\\nthat can scale, is cloud agnostic, and is open source too?\"), mdx(\"p\", null, \"If so, you should join Coqui as part of our MLOps Team. At Coqui we\\u2019re looking to redefine how humans interact\\nwith computers through that most natural of interfaces, speech, and we require the skills of a senior MLOps\\nengineer to build \\u201Cground-up\\u201D our training pipeline. Interested?\"), mdx(\"h3\", {\n    \"id\": \"at-coqui-you-will\",\n    \"style\": {\n      \"position\": \"relative\"\n    }\n  }, mdx(\"a\", {\n    parentName: \"h3\",\n    \"href\": \"#at-coqui-you-will\",\n    \"aria-label\": \"at coqui you will permalink\",\n    \"className\": \"anchor before\"\n  }, mdx(\"svg\", {\n    parentName: \"a\",\n    \"xmlns\": \"http://www.w3.org/2000/svg\",\n    \"width\": \"16\",\n    \"height\": \"16\",\n    \"focusable\": \"false\",\n    \"viewBox\": \"0 0 16 16\"\n  }, \"\\n  \", mdx(\"path\", {\n    parentName: \"svg\",\n    \"fill\": \"currentColor\",\n    \"d\": \"M4.441 7.38l.095.083.939.939-.708.707-.939-.939-2 2-.132.142a2.829 2.829 0 003.99 3.99l.142-.132 2-2-.939-.939.707-.708.94.94a1 1 0 01.083 1.32l-.083.094-2 2A3.828 3.828 0 01.972 9.621l.15-.158 2-2A1 1 0 014.34 7.31l.101.07zm7.413-3.234a.5.5 0 01.057.638l-.057.07-7 7a.5.5 0 01-.765-.638l.057-.07 7-7a.5.5 0 01.708 0zm3.023-3.025a3.829 3.829 0 01.15 5.257l-.15.158-2 2a1 1 0 01-1.32.083l-.094-.083-.94-.94.708-.707.939.94 2-2 .132-.142a2.829 2.829 0 00-3.99-3.99l-.142.131-2 2 .939.939-.707.708-.94-.94a1 1 0 01-.082-1.32l.083-.094 2-2a3.828 3.828 0 015.414 0z\"\n  }))), \"At Coqui you will:\"), mdx(\"ul\", null, mdx(\"li\", {\n    parentName: \"ul\"\n  }, \"Select the open technologies which will form the foundation Coqui\\u2019s open training pipeline\"), mdx(\"li\", {\n    parentName: \"ul\"\n  }, \"Build and own Coqui\\u2019s open training pipeline based on your technology selections\"), mdx(\"li\", {\n    parentName: \"ul\"\n  }, \"Collaborate with Coqui\\u2019s ML experts in integrating our speech-to-text (STT) and text-to-speech (TTS) into your open pipeline\"), mdx(\"li\", {\n    parentName: \"ul\"\n  }, \"Collaborate with Coqui\\u2019s provisioning experts in integrating provisioning into your open pipeline\"), mdx(\"li\", {\n    parentName: \"ul\"\n  }, \"Collaborate with Coqui\\u2019s UI/UX experts in providing a UI to your open training pipeline\"), mdx(\"li\", {\n    parentName: \"ul\"\n  }, \"Collaborate with Coqui\\u2019s product experts on the open training pipeline features and designs\")), mdx(\"h3\", {\n    \"id\": \"your-professional-profile\",\n    \"style\": {\n      \"position\": \"relative\"\n    }\n  }, mdx(\"a\", {\n    parentName: \"h3\",\n    \"href\": \"#your-professional-profile\",\n    \"aria-label\": \"your professional profile permalink\",\n    \"className\": \"anchor before\"\n  }, mdx(\"svg\", {\n    parentName: \"a\",\n    \"xmlns\": \"http://www.w3.org/2000/svg\",\n    \"width\": \"16\",\n    \"height\": \"16\",\n    \"focusable\": \"false\",\n    \"viewBox\": \"0 0 16 16\"\n  }, \"\\n  \", mdx(\"path\", {\n    parentName: \"svg\",\n    \"fill\": \"currentColor\",\n    \"d\": \"M4.441 7.38l.095.083.939.939-.708.707-.939-.939-2 2-.132.142a2.829 2.829 0 003.99 3.99l.142-.132 2-2-.939-.939.707-.708.94.94a1 1 0 01.083 1.32l-.083.094-2 2A3.828 3.828 0 01.972 9.621l.15-.158 2-2A1 1 0 014.34 7.31l.101.07zm7.413-3.234a.5.5 0 01.057.638l-.057.07-7 7a.5.5 0 01-.765-.638l.057-.07 7-7a.5.5 0 01.708 0zm3.023-3.025a3.829 3.829 0 01.15 5.257l-.15.158-2 2a1 1 0 01-1.32.083l-.094-.083-.94-.94.708-.707.939.94 2-2 .132-.142a2.829 2.829 0 00-3.99-3.99l-.142.131-2 2 .939.939-.707.708-.94-.94a1 1 0 01-.082-1.32l.083-.094 2-2a3.828 3.828 0 015.414 0z\"\n  }))), \"Your professional profile:\"), mdx(\"h4\", {\n    \"id\": \"requirements\",\n    \"style\": {\n      \"position\": \"relative\"\n    }\n  }, mdx(\"a\", {\n    parentName: \"h4\",\n    \"href\": \"#requirements\",\n    \"aria-label\": \"requirements permalink\",\n    \"className\": \"anchor before\"\n  }, mdx(\"svg\", {\n    parentName: \"a\",\n    \"xmlns\": \"http://www.w3.org/2000/svg\",\n    \"width\": \"16\",\n    \"height\": \"16\",\n    \"focusable\": \"false\",\n    \"viewBox\": \"0 0 16 16\"\n  }, \"\\n  \", mdx(\"path\", {\n    parentName: \"svg\",\n    \"fill\": \"currentColor\",\n    \"d\": \"M4.441 7.38l.095.083.939.939-.708.707-.939-.939-2 2-.132.142a2.829 2.829 0 003.99 3.99l.142-.132 2-2-.939-.939.707-.708.94.94a1 1 0 01.083 1.32l-.083.094-2 2A3.828 3.828 0 01.972 9.621l.15-.158 2-2A1 1 0 014.34 7.31l.101.07zm7.413-3.234a.5.5 0 01.057.638l-.057.07-7 7a.5.5 0 01-.765-.638l.057-.07 7-7a.5.5 0 01.708 0zm3.023-3.025a3.829 3.829 0 01.15 5.257l-.15.158-2 2a1 1 0 01-1.32.083l-.094-.083-.94-.94.708-.707.939.94 2-2 .132-.142a2.829 2.829 0 00-3.99-3.99l-.142.131-2 2 .939.939-.707.708-.94-.94a1 1 0 01-.082-1.32l.083-.094 2-2a3.828 3.828 0 015.414 0z\"\n  }))), \"Requirements\"), mdx(\"ul\", null, mdx(\"li\", {\n    parentName: \"ul\"\n  }, \"3+ years of relevant experience, i.e. DevOps in a ML context\"), mdx(\"li\", {\n    parentName: \"ul\"\n  }, \"Good overview of current ML technologies and tools\"), mdx(\"li\", {\n    parentName: \"ul\"\n  }, \"Deep understanding of at least one MLOps training pipeline tool (e.g. MLFlow, ZenML, TFX\\u2026)\"), mdx(\"li\", {\n    parentName: \"ul\"\n  }, \"Good understanding of at least one MLOps provisioning tool (e.g. Terraform, CloudFormation\\u2026)\"), mdx(\"li\", {\n    parentName: \"ul\"\n  }, \"Good understanding of at least one MLOps deployment tool (e.g. Seldon, BentoML\\u2026)\"), mdx(\"li\", {\n    parentName: \"ul\"\n  }, \"Good understanding of at least one ML toolkit (e.g. Tensorflow, Pytorch\\u2026)\"), mdx(\"li\", {\n    parentName: \"ul\"\n  }, \"Experience owning a project from concept to production, including proposal, discussion, and execution\"), mdx(\"li\", {\n    parentName: \"ul\"\n  }, \"Self-motivated and self-managing, with strong organizational skills\"), mdx(\"li\", {\n    parentName: \"ul\"\n  }, \"Strong technical communication skills\")), mdx(\"h4\", {\n    \"id\": \"preferred-qualifications\",\n    \"style\": {\n      \"position\": \"relative\"\n    }\n  }, mdx(\"a\", {\n    parentName: \"h4\",\n    \"href\": \"#preferred-qualifications\",\n    \"aria-label\": \"preferred qualifications permalink\",\n    \"className\": \"anchor before\"\n  }, mdx(\"svg\", {\n    parentName: \"a\",\n    \"xmlns\": \"http://www.w3.org/2000/svg\",\n    \"width\": \"16\",\n    \"height\": \"16\",\n    \"focusable\": \"false\",\n    \"viewBox\": \"0 0 16 16\"\n  }, \"\\n  \", mdx(\"path\", {\n    parentName: \"svg\",\n    \"fill\": \"currentColor\",\n    \"d\": \"M4.441 7.38l.095.083.939.939-.708.707-.939-.939-2 2-.132.142a2.829 2.829 0 003.99 3.99l.142-.132 2-2-.939-.939.707-.708.94.94a1 1 0 01.083 1.32l-.083.094-2 2A3.828 3.828 0 01.972 9.621l.15-.158 2-2A1 1 0 014.34 7.31l.101.07zm7.413-3.234a.5.5 0 01.057.638l-.057.07-7 7a.5.5 0 01-.765-.638l.057-.07 7-7a.5.5 0 01.708 0zm3.023-3.025a3.829 3.829 0 01.15 5.257l-.15.158-2 2a1 1 0 01-1.32.083l-.094-.083-.94-.94.708-.707.939.94 2-2 .132-.142a2.829 2.829 0 00-3.99-3.99l-.142.131-2 2 .939.939-.707.708-.94-.94a1 1 0 01-.082-1.32l.083-.094 2-2a3.828 3.828 0 015.414 0z\"\n  }))), \"Preferred Qualifications\"), mdx(\"ul\", null, mdx(\"li\", {\n    parentName: \"ul\"\n  }, \"Experience creating, launching, and maintaining an MLOps training pipeline solution\"), mdx(\"li\", {\n    parentName: \"ul\"\n  }, \"Experience with STT and/or TTS ML systems\"), mdx(\"li\", {\n    parentName: \"ul\"\n  }, \"Experience working with a remote team\"), mdx(\"li\", {\n    parentName: \"ul\"\n  }, \"Experience with open source projects\"), mdx(\"li\", {\n    parentName: \"ul\"\n  }, \"Experience in a startup environment\")), mdx(\"h3\", {\n    \"id\": \"about-coqui\",\n    \"style\": {\n      \"position\": \"relative\"\n    }\n  }, mdx(\"a\", {\n    parentName: \"h3\",\n    \"href\": \"#about-coqui\",\n    \"aria-label\": \"about coqui permalink\",\n    \"className\": \"anchor before\"\n  }, mdx(\"svg\", {\n    parentName: \"a\",\n    \"xmlns\": \"http://www.w3.org/2000/svg\",\n    \"width\": \"16\",\n    \"height\": \"16\",\n    \"focusable\": \"false\",\n    \"viewBox\": \"0 0 16 16\"\n  }, \"\\n  \", mdx(\"path\", {\n    parentName: \"svg\",\n    \"fill\": \"currentColor\",\n    \"d\": \"M4.441 7.38l.095.083.939.939-.708.707-.939-.939-2 2-.132.142a2.829 2.829 0 003.99 3.99l.142-.132 2-2-.939-.939.707-.708.94.94a1 1 0 01.083 1.32l-.083.094-2 2A3.828 3.828 0 01.972 9.621l.15-.158 2-2A1 1 0 014.34 7.31l.101.07zm7.413-3.234a.5.5 0 01.057.638l-.057.07-7 7a.5.5 0 01-.765-.638l.057-.07 7-7a.5.5 0 01.708 0zm3.023-3.025a3.829 3.829 0 01.15 5.257l-.15.158-2 2a1 1 0 01-1.32.083l-.094-.083-.94-.94.708-.707.939.94 2-2 .132-.142a2.829 2.829 0 00-3.99-3.99l-.142.131-2 2 .939.939-.707.708-.94-.94a1 1 0 01-.082-1.32l.083-.094 2-2a3.828 3.828 0 015.414 0z\"\n  }))), \"About Coqui:\"), mdx(\"p\", null, \"Coqui was founded by the creators of Mozilla\\u2019s text-to-speech and speech-to-text engines (over 5M downloads and\\n30K GitHub stars), has the backing of fantastic investors from around the globe,\\nhas a friendly & diverse developer community, and we\\u2019re just getting started.\"), mdx(\"p\", null, \"At Coqui we are redefining how humans interact with computers through that most natural of interfaces, speech.\"), mdx(\"p\", null, \"Also we believe that open and free is better than closed and controlled. So our core speech-to-text and text-to-speech\\nengines are open to all, providing an evermore critical technology, speech, to the world. So when you join Coqui\\nyou have the opportunity to make a dent in the universe, bringing voice to the world.\"), mdx(\"p\", null, \"Coqui is privately held, founded in 2021, and is headquartered in Berlin. We are a remote-friendly company with lots\\nof experience working with distributed teams.\"), mdx(\"p\", null, \"We are an equal opportunity employer and value diversity. We do not discriminate on the basis of race, religion,\\ncolor, national origin, gender, sexual orientation, age, marital status, veteran status, or disability status.\"), mdx(\"h3\", {\n    \"id\": \"how-to-apply\",\n    \"style\": {\n      \"position\": \"relative\"\n    }\n  }, mdx(\"a\", {\n    parentName: \"h3\",\n    \"href\": \"#how-to-apply\",\n    \"aria-label\": \"how to apply permalink\",\n    \"className\": \"anchor before\"\n  }, mdx(\"svg\", {\n    parentName: \"a\",\n    \"xmlns\": \"http://www.w3.org/2000/svg\",\n    \"width\": \"16\",\n    \"height\": \"16\",\n    \"focusable\": \"false\",\n    \"viewBox\": \"0 0 16 16\"\n  }, \"\\n  \", mdx(\"path\", {\n    parentName: \"svg\",\n    \"fill\": \"currentColor\",\n    \"d\": \"M4.441 7.38l.095.083.939.939-.708.707-.939-.939-2 2-.132.142a2.829 2.829 0 003.99 3.99l.142-.132 2-2-.939-.939.707-.708.94.94a1 1 0 01.083 1.32l-.083.094-2 2A3.828 3.828 0 01.972 9.621l.15-.158 2-2A1 1 0 014.34 7.31l.101.07zm7.413-3.234a.5.5 0 01.057.638l-.057.07-7 7a.5.5 0 01-.765-.638l.057-.07 7-7a.5.5 0 01.708 0zm3.023-3.025a3.829 3.829 0 01.15 5.257l-.15.158-2 2a1 1 0 01-1.32.083l-.094-.083-.94-.94.708-.707.939.94 2-2 .132-.142a2.829 2.829 0 00-3.99-3.99l-.142.131-2 2 .939.939-.707.708-.94-.94a1 1 0 01-.082-1.32l.083-.094 2-2a3.828 3.828 0 015.414 0z\"\n  }))), \"How to Apply:\"), mdx(\"p\", null, \"Send your CV in PDF format to \", mdx(\"a\", {\n    parentName: \"p\",\n    \"href\": \"mailto:jobs@coqui.ai\"\n  }, \"jobs@coqui.ai\")));\n}\n;\nMDXContent.isMDXComponent = true;","tableOfContents":{"items":[{"url":"#at-coqui-you-will","title":"At Coqui you will:"},{"url":"#your-professional-profile","title":"Your professional profile:"},{"url":"#about-coqui","title":"About Coqui:"},{"url":"#how-to-apply","title":"How to Apply:"}]}}},"pageContext":{"frontmatter":{"title":"Senior MLOps Training Pipeline Engineer","name":"Coqui","picture":"https://avatars.githubusercontent.com/u/75583352?s=400&u=9640c480b84c161c8976d1ebbf2ec3f803f9d82e&v=4","date":"March 23, 2022"},"fileAbsolutePath":"/Users/kdavis/Code/coqui-ai/coqui-ai.github.io/src/pages/job/senior-mlops-training-pipeline-engineer.mdx"}},"staticQueryHashes":["1942088059","3709355695"]}