{"componentChunkName":"component---src-pages-blog-tts-unleashing-emotion-with-xtts-mdx","path":"/blog/tts/unleashing_emotion_with_xtts","result":{"data":{"mdx":{"id":"63ad8280-f3d4-51a5-a0c6-759eaffde7f9","excerpt":"Setting the Stage: Unleashing Emotion with XTTS Game development is an art, and the smallest details can make the biggest difference. We all‚Ä¶","body":"var _excluded = [\"components\"];\n\nvar _templateObject;\n\nfunction _extends() { _extends = Object.assign ? Object.assign.bind() : function (target) { for (var i = 1; i < arguments.length; i++) { var source = arguments[i]; for (var key in source) { if (Object.prototype.hasOwnProperty.call(source, key)) { target[key] = source[key]; } } } return target; }; return _extends.apply(this, arguments); }\n\nfunction _objectWithoutProperties(source, excluded) { if (source == null) return {}; var target = _objectWithoutPropertiesLoose(source, excluded); var key, i; if (Object.getOwnPropertySymbols) { var sourceSymbolKeys = Object.getOwnPropertySymbols(source); for (i = 0; i < sourceSymbolKeys.length; i++) { key = sourceSymbolKeys[i]; if (excluded.indexOf(key) >= 0) continue; if (!Object.prototype.propertyIsEnumerable.call(source, key)) continue; target[key] = source[key]; } } return target; }\n\nfunction _objectWithoutPropertiesLoose(source, excluded) { if (source == null) return {}; var target = {}; var sourceKeys = Object.keys(source); var key, i; for (i = 0; i < sourceKeys.length; i++) { key = sourceKeys[i]; if (excluded.indexOf(key) >= 0) continue; target[key] = source[key]; } return target; }\n\nfunction _taggedTemplateLiteral(strings, raw) { if (!raw) { raw = strings.slice(0); } return Object.freeze(Object.defineProperties(strings, { raw: { value: Object.freeze(raw) } })); }\n\n/* @jsxRuntime classic */\n\n/* @jsx mdx */\nvar pageQuery = graphql(_templateObject || (_templateObject = _taggedTemplateLiteral([\"\\n  query($fileAbsolutePath: String) {\\n    ...SidebarPageFragment\\n  }\\n\"])));\nvar _frontmatter = {\n  \"title\": \"Unleashing Emotion with XTTS\",\n  \"name\": \"Team Coqui üê∏\",\n  \"picture\": \"https://avatars.githubusercontent.com/u/75583352?s=96&v=4\",\n  \"date\": \"July 26, 2023\"\n};\n\nvar makeShortcode = function makeShortcode(name) {\n  return function MDXDefaultShortcode(props) {\n    console.warn(\"Component \" + name + \" was not imported, exported, or provided by MDXProvider as global scope\");\n    return mdx(\"div\", props);\n  };\n};\n\nvar Link = makeShortcode(\"Link\");\nvar layoutProps = {\n  pageQuery: pageQuery,\n  _frontmatter: _frontmatter\n};\nvar MDXLayout = \"wrapper\";\nreturn function MDXContent(_ref) {\n  var components = _ref.components,\n      props = _objectWithoutProperties(_ref, _excluded);\n\n  return mdx(MDXLayout, _extends({}, layoutProps, props, {\n    components: components,\n    mdxType: \"MDXLayout\"\n  }), mdx(\"h3\", {\n    \"id\": \"setting-the-stage-unleashing-emotion-with-xtts\",\n    \"style\": {\n      \"position\": \"relative\"\n    }\n  }, mdx(\"a\", {\n    parentName: \"h3\",\n    \"href\": \"#setting-the-stage-unleashing-emotion-with-xtts\",\n    \"aria-label\": \"setting the stage unleashing emotion with xtts permalink\",\n    \"className\": \"anchor before\"\n  }, mdx(\"svg\", {\n    parentName: \"a\",\n    \"xmlns\": \"http://www.w3.org/2000/svg\",\n    \"width\": \"16\",\n    \"height\": \"16\",\n    \"focusable\": \"false\",\n    \"viewBox\": \"0 0 16 16\"\n  }, \"\\n  \", mdx(\"path\", {\n    parentName: \"svg\",\n    \"fill\": \"currentColor\",\n    \"d\": \"M4.441 7.38l.095.083.939.939-.708.707-.939-.939-2 2-.132.142a2.829 2.829 0 003.99 3.99l.142-.132 2-2-.939-.939.707-.708.94.94a1 1 0 01.083 1.32l-.083.094-2 2A3.828 3.828 0 01.972 9.621l.15-.158 2-2A1 1 0 014.34 7.31l.101.07zm7.413-3.234a.5.5 0 01.057.638l-.057.07-7 7a.5.5 0 01-.765-.638l.057-.07 7-7a.5.5 0 01.708 0zm3.023-3.025a3.829 3.829 0 01.15 5.257l-.15.158-2 2a1 1 0 01-1.32.083l-.094-.083-.94-.94.708-.707.939.94 2-2 .132-.142a2.829 2.829 0 00-3.99-3.99l-.142.131-2 2 .939.939-.707.708-.94-.94a1 1 0 01-.082-1.32l.083-.094 2-2a3.828 3.828 0 015.414 0z\"\n  }))), \"Setting the Stage: Unleashing Emotion with XTTS\"), mdx(\"p\", null, \"Game development is an art, and the smallest details can make the biggest difference. We all know\\nthat visual graphics and an engaging storyline are crucial. But have you ever thought about how\\nimportant the quality of character voices is? More than just words, it\\u2019s the emotion, tone, and\\ndelivery that truly bring a character to life. That\\u2019s where XTTS\\u2013an advanced, Generative Voice\\nAI\\u2013enters the scene.\"), mdx(\"p\", null, \"The impact of a game character\\u2019s voice cannot be overstated. It gives life to your characters,\\nadding depth and personality that visuals alone cannot achieve. XTTS takes this a step further,\\noffering nuanced emotions and subtleties of human speech to transform your characters from mere\\nfigures to believable personas. Let\\u2019s explore the game-changing power of this Generative Voice\\nAI platform.\"), mdx(\"h3\", {\n    \"id\": \"a-symphony-of-voices-generative-voice-ai-game-characters\",\n    \"style\": {\n      \"position\": \"relative\"\n    }\n  }, mdx(\"a\", {\n    parentName: \"h3\",\n    \"href\": \"#a-symphony-of-voices-generative-voice-ai-game-characters\",\n    \"aria-label\": \"a symphony of voices generative voice ai game characters permalink\",\n    \"className\": \"anchor before\"\n  }, mdx(\"svg\", {\n    parentName: \"a\",\n    \"xmlns\": \"http://www.w3.org/2000/svg\",\n    \"width\": \"16\",\n    \"height\": \"16\",\n    \"focusable\": \"false\",\n    \"viewBox\": \"0 0 16 16\"\n  }, \"\\n  \", mdx(\"path\", {\n    parentName: \"svg\",\n    \"fill\": \"currentColor\",\n    \"d\": \"M4.441 7.38l.095.083.939.939-.708.707-.939-.939-2 2-.132.142a2.829 2.829 0 003.99 3.99l.142-.132 2-2-.939-.939.707-.708.94.94a1 1 0 01.083 1.32l-.083.094-2 2A3.828 3.828 0 01.972 9.621l.15-.158 2-2A1 1 0 014.34 7.31l.101.07zm7.413-3.234a.5.5 0 01.057.638l-.057.07-7 7a.5.5 0 01-.765-.638l.057-.07 7-7a.5.5 0 01.708 0zm3.023-3.025a3.829 3.829 0 01.15 5.257l-.15.158-2 2a1 1 0 01-1.32.083l-.094-.083-.94-.94.708-.707.939.94 2-2 .132-.142a2.829 2.829 0 00-3.99-3.99l-.142.131-2 2 .939.939-.707.708-.94-.94a1 1 0 01-.082-1.32l.083-.094 2-2a3.828 3.828 0 015.414 0z\"\n  }))), \"A Symphony of Voices: Generative Voice AI Game Characters\"), mdx(\"p\", null, \"XTTS doesn\\u2019t just create voices - it generates a symphony of character-rich vocals. XTTS voices\\ncan emote, ensuring your game\\u2019s universe is as varied and vibrant as the real world. With such\\nan array of voices and emotions, each of your characters can truly speak in their own unique\\nway, captivating your players and creating a deeper connection with the game.\"), mdx(\"p\", null, \"XTTS\\u2019s Generative Voice AI allows you to experiment with various emotions and tones, from jubilant\\nvictory shouts to heart-wrenching cries of defeat. These aren\\u2019t just synthetic voices; they are\\nan orchestration of emotions, adding character and depth.\"), mdx(\"div\", {\n    align: \"center\"\n  }, mdx(\"iframe\", {\n    style: {\n      \"width\": \"640px\",\n      \"height\": \"360px\",\n      \"borderWidth\": \"0px 0px 0px 0px\",\n      \"borderStyle\": \"solid solid solid solid\",\n      \"borderColor\": \"black black black black\"\n    },\n    src: \"https://youtube.com/embed/ofwEUSfk-2M?autoplay=1&loop=1&playlist=ofwEUSfk-2M\",\n    allow: \"accelerometer; autoplay; encrypted-media; gyroscope; picture-in-picture\",\n    allowFullScreen: true\n  })), mdx(\"h3\", {\n    \"id\": \"faster-better-more-creative-the-xtts-advantage\",\n    \"style\": {\n      \"position\": \"relative\"\n    }\n  }, mdx(\"a\", {\n    parentName: \"h3\",\n    \"href\": \"#faster-better-more-creative-the-xtts-advantage\",\n    \"aria-label\": \"faster better more creative the xtts advantage permalink\",\n    \"className\": \"anchor before\"\n  }, mdx(\"svg\", {\n    parentName: \"a\",\n    \"xmlns\": \"http://www.w3.org/2000/svg\",\n    \"width\": \"16\",\n    \"height\": \"16\",\n    \"focusable\": \"false\",\n    \"viewBox\": \"0 0 16 16\"\n  }, \"\\n  \", mdx(\"path\", {\n    parentName: \"svg\",\n    \"fill\": \"currentColor\",\n    \"d\": \"M4.441 7.38l.095.083.939.939-.708.707-.939-.939-2 2-.132.142a2.829 2.829 0 003.99 3.99l.142-.132 2-2-.939-.939.707-.708.94.94a1 1 0 01.083 1.32l-.083.094-2 2A3.828 3.828 0 01.972 9.621l.15-.158 2-2A1 1 0 014.34 7.31l.101.07zm7.413-3.234a.5.5 0 01.057.638l-.057.07-7 7a.5.5 0 01-.765-.638l.057-.07 7-7a.5.5 0 01.708 0zm3.023-3.025a3.829 3.829 0 01.15 5.257l-.15.158-2 2a1 1 0 01-1.32.083l-.094-.083-.94-.94.708-.707.939.94 2-2 .132-.142a2.829 2.829 0 00-3.99-3.99l-.142.131-2 2 .939.939-.707.708-.94-.94a1 1 0 01-.082-1.32l.083-.094 2-2a3.828 3.828 0 015.414 0z\"\n  }))), \"Faster, Better, More Creative: The XTTS Advantage\"), mdx(\"p\", null, \"XTTS is not just about quality, it\\u2019s also about speed. XTTS\\u2019s Generative Voice AI allows you to\\ncreate dialogue at an incredible pace. Simply type the dialogue, tweak the settings to fit your\\ncharacter\\u2019s emotions and personality, and generate the audio. You can get the perfect voiceover\\nin minutes, not days.\"), mdx(\"p\", null, \"What\\u2019s more, XTTS is designed to promote creativity. The intuitive platform lets you experiment\\nand refine until you get the perfect vocal performance for each line of dialogue.\"), mdx(\"h3\", {\n    \"id\": \"xtts-your-invitation-to-an-unmatched-gaming-experience\",\n    \"style\": {\n      \"position\": \"relative\"\n    }\n  }, mdx(\"a\", {\n    parentName: \"h3\",\n    \"href\": \"#xtts-your-invitation-to-an-unmatched-gaming-experience\",\n    \"aria-label\": \"xtts your invitation to an unmatched gaming experience permalink\",\n    \"className\": \"anchor before\"\n  }, mdx(\"svg\", {\n    parentName: \"a\",\n    \"xmlns\": \"http://www.w3.org/2000/svg\",\n    \"width\": \"16\",\n    \"height\": \"16\",\n    \"focusable\": \"false\",\n    \"viewBox\": \"0 0 16 16\"\n  }, \"\\n  \", mdx(\"path\", {\n    parentName: \"svg\",\n    \"fill\": \"currentColor\",\n    \"d\": \"M4.441 7.38l.095.083.939.939-.708.707-.939-.939-2 2-.132.142a2.829 2.829 0 003.99 3.99l.142-.132 2-2-.939-.939.707-.708.94.94a1 1 0 01.083 1.32l-.083.094-2 2A3.828 3.828 0 01.972 9.621l.15-.158 2-2A1 1 0 014.34 7.31l.101.07zm7.413-3.234a.5.5 0 01.057.638l-.057.07-7 7a.5.5 0 01-.765-.638l.057-.07 7-7a.5.5 0 01.708 0zm3.023-3.025a3.829 3.829 0 01.15 5.257l-.15.158-2 2a1 1 0 01-1.32.083l-.094-.083-.94-.94.708-.707.939.94 2-2 .132-.142a2.829 2.829 0 00-3.99-3.99l-.142.131-2 2 .939.939-.707.708-.94-.94a1 1 0 01-.082-1.32l.083-.094 2-2a3.828 3.828 0 015.414 0z\"\n  }))), \"XTTS: Your Invitation to an Unmatched Gaming Experience\"), mdx(\"p\", null, \"Remember the feeling when you first fell in love with gaming? That\\u2019s the experience you aim to\\ncreate for your players. With XTTS, you\\u2019re not just developing a game - you\\u2019re creating an\\nimmersive, emotionally-charged universe where every character has a distinctive voice.\"), mdx(\"p\", null, \"The power of XTTS\\u2019s advanced Generative Voice AI cannot be overstated. Unleash your creativity,\\nexplore the multitude of voice options, and make your game characters truly unforgettable with\\nXTTS.\"), mdx(\"h3\", {\n    \"id\": \"ready-to-give-xtts-a-shot\",\n    \"style\": {\n      \"position\": \"relative\"\n    }\n  }, mdx(\"a\", {\n    parentName: \"h3\",\n    \"href\": \"#ready-to-give-xtts-a-shot\",\n    \"aria-label\": \"ready to give xtts a shot permalink\",\n    \"className\": \"anchor before\"\n  }, mdx(\"svg\", {\n    parentName: \"a\",\n    \"xmlns\": \"http://www.w3.org/2000/svg\",\n    \"width\": \"16\",\n    \"height\": \"16\",\n    \"focusable\": \"false\",\n    \"viewBox\": \"0 0 16 16\"\n  }, \"\\n  \", mdx(\"path\", {\n    parentName: \"svg\",\n    \"fill\": \"currentColor\",\n    \"d\": \"M4.441 7.38l.095.083.939.939-.708.707-.939-.939-2 2-.132.142a2.829 2.829 0 003.99 3.99l.142-.132 2-2-.939-.939.707-.708.94.94a1 1 0 01.083 1.32l-.083.094-2 2A3.828 3.828 0 01.972 9.621l.15-.158 2-2A1 1 0 014.34 7.31l.101.07zm7.413-3.234a.5.5 0 01.057.638l-.057.07-7 7a.5.5 0 01-.765-.638l.057-.07 7-7a.5.5 0 01.708 0zm3.023-3.025a3.829 3.829 0 01.15 5.257l-.15.158-2 2a1 1 0 01-1.32.083l-.094-.083-.94-.94.708-.707.939.94 2-2 .132-.142a2.829 2.829 0 00-3.99-3.99l-.142.131-2 2 .939.939-.707.708-.94-.94a1 1 0 01-.082-1.32l.083-.094 2-2a3.828 3.828 0 015.414 0z\"\n  }))), \"Ready to Give XTTS a Shot?\"), mdx(\"p\", null, \"We\\u2019re excited about the potential XTTS holds for the gaming industry, and we believe it\\u2019s an\\nessential tool for any game developer focused on delivering immersive experiences. Give it a\\nspin, and experience firsthand the depth and emotion it can bring to your game characters.\"), mdx(\"p\", null, \"Remember, we\\u2019re always here to assist you and are open to your feedback and questions. Your\\ninput helps us make XTTS even better, so don\\u2019t hesitate to share your experiences. Let XTTS\\nbe your key to creating the vivid, immersive gaming experiences your players crave!\"), mdx(\"div\", {\n    align: \"center\"\n  }, mdx(Link, {\n    to: \"https://app.coqui.ai/auth/signup\",\n    mdxType: \"Link\"\n  }, mdx(\"p\", null, mdx(\"span\", {\n    parentName: \"p\",\n    \"className\": \"gatsby-resp-image-wrapper\",\n    \"style\": {\n      \"position\": \"relative\",\n      \"display\": \"block\",\n      \"marginLeft\": \"auto\",\n      \"marginRight\": \"auto\",\n      \"maxWidth\": \"137px\"\n    }\n  }, \"\\n      \", mdx(\"span\", {\n    parentName: \"span\",\n    \"className\": \"gatsby-resp-image-background-image\",\n    \"style\": {\n      \"paddingBottom\": \"34.306569343065696%\",\n      \"position\": \"relative\",\n      \"bottom\": \"0\",\n      \"left\": \"0\",\n      \"display\": \"block\"\n    }\n  }), \"\\n  \", mdx(\"img\", {\n    parentName: \"span\",\n    \"className\": \"gatsby-resp-image-image\",\n    \"alt\": \"IMAGE\",\n    \"title\": \"IMAGE\",\n    \"src\": \"/static/0addc085d063dac762fd9b75a388f199/3f2c9/blog-unleashing-emotion-with-xtts-try-now-for-free.png\",\n    \"srcSet\": [\"/static/0addc085d063dac762fd9b75a388f199/3f2c9/blog-unleashing-emotion-with-xtts-try-now-for-free.png 137w\"],\n    \"sizes\": \"(max-width: 137px) 100vw, 137px\",\n    \"style\": {\n      \"width\": \"100%\",\n      \"height\": \"100%\",\n      \"margin\": \"0\",\n      \"verticalAlign\": \"middle\",\n      \"position\": \"absolute\",\n      \"top\": \"0\",\n      \"left\": \"0\"\n    },\n    \"loading\": \"lazy\"\n  }), \"\\n    \")))));\n}\n;\nMDXContent.isMDXComponent = true;","tableOfContents":{"items":[{"url":"#setting-the-stage-unleashing-emotion-with-xtts","title":"Setting the Stage: Unleashing Emotion with XTTS"},{"url":"#a-symphony-of-voices-generative-voice-ai-game-characters","title":"A Symphony of Voices: Generative Voice AI Game Characters"},{"url":"#faster-better-more-creative-the-xtts-advantage","title":"Faster, Better, More Creative: The XTTS Advantage"},{"url":"#xtts-your-invitation-to-an-unmatched-gaming-experience","title":"XTTS: Your Invitation to an Unmatched Gaming Experience"},{"url":"#ready-to-give-xtts-a-shot","title":"Ready to Give XTTS a Shot?"}]}}},"pageContext":{"frontmatter":{"title":"Unleashing Emotion with XTTS","name":"Team Coqui üê∏","picture":"https://avatars.githubusercontent.com/u/75583352?s=96&v=4","date":"July 26, 2023"},"fileAbsolutePath":"/home/runner/work/coqui-ai.github.io/coqui-ai.github.io/src/pages/blog/tts/unleashing_emotion_with_xtts.mdx"}},"staticQueryHashes":["1942088059","3709355695"]}