{"componentChunkName":"component---src-pages-blog-tts-unleashing-the-power-of-xtts-mdx","path":"/blog/tts/unleashing_the_power_of_xtts","result":{"data":{"mdx":{"id":"582c4416-bcb5-5aa9-a8a4-68a957037a35","excerpt":"Isn't it awe-inspiring to see your game characters come to life, not just with powerful\ngraphics and incredible gameplay but also with‚Ä¶","body":"var _excluded = [\"components\"];\n\nvar _templateObject;\n\nfunction _extends() { _extends = Object.assign ? Object.assign.bind() : function (target) { for (var i = 1; i < arguments.length; i++) { var source = arguments[i]; for (var key in source) { if (Object.prototype.hasOwnProperty.call(source, key)) { target[key] = source[key]; } } } return target; }; return _extends.apply(this, arguments); }\n\nfunction _objectWithoutProperties(source, excluded) { if (source == null) return {}; var target = _objectWithoutPropertiesLoose(source, excluded); var key, i; if (Object.getOwnPropertySymbols) { var sourceSymbolKeys = Object.getOwnPropertySymbols(source); for (i = 0; i < sourceSymbolKeys.length; i++) { key = sourceSymbolKeys[i]; if (excluded.indexOf(key) >= 0) continue; if (!Object.prototype.propertyIsEnumerable.call(source, key)) continue; target[key] = source[key]; } } return target; }\n\nfunction _objectWithoutPropertiesLoose(source, excluded) { if (source == null) return {}; var target = {}; var sourceKeys = Object.keys(source); var key, i; for (i = 0; i < sourceKeys.length; i++) { key = sourceKeys[i]; if (excluded.indexOf(key) >= 0) continue; target[key] = source[key]; } return target; }\n\nfunction _taggedTemplateLiteral(strings, raw) { if (!raw) { raw = strings.slice(0); } return Object.freeze(Object.defineProperties(strings, { raw: { value: Object.freeze(raw) } })); }\n\n/* @jsxRuntime classic */\n\n/* @jsx mdx */\nvar pageQuery = graphql(_templateObject || (_templateObject = _taggedTemplateLiteral([\"\\n  query($fileAbsolutePath: String) {\\n    ...SidebarPageFragment\\n  }\\n\"])));\nvar _frontmatter = {\n  \"title\": \"Unleashing the Power of XTTS: A Revolution in Gaming Immersion\",\n  \"name\": \"Team Coqui üê∏\",\n  \"picture\": \"https://avatars.githubusercontent.com/u/75583352?s=96&v=4\",\n  \"date\": \"August 9, 2023\"\n};\n\nvar makeShortcode = function makeShortcode(name) {\n  return function MDXDefaultShortcode(props) {\n    console.warn(\"Component \" + name + \" was not imported, exported, or provided by MDXProvider as global scope\");\n    return mdx(\"div\", props);\n  };\n};\n\nvar Link = makeShortcode(\"Link\");\nvar layoutProps = {\n  pageQuery: pageQuery,\n  _frontmatter: _frontmatter\n};\nvar MDXLayout = \"wrapper\";\nreturn function MDXContent(_ref) {\n  var components = _ref.components,\n      props = _objectWithoutProperties(_ref, _excluded);\n\n  return mdx(MDXLayout, _extends({}, layoutProps, props, {\n    components: components,\n    mdxType: \"MDXLayout\"\n  }), mdx(\"p\", null, \"Isn\\u2019t it awe-inspiring to see your game characters come to life, not just with powerful\\ngraphics and incredible gameplay but also with voices that express a whole range of\\nemotions and character nuances? Welcome to the future of gaming audio - a future defined\\nby XTTS, a revolutionary Generative Voice AI! It\\u2019s not just about improving game audio,\\nbut reshaping the way players experience the gaming world.\"), mdx(\"h3\", {\n    \"id\": \"adding-depth-and-realism-with-generative-voice-ai\",\n    \"style\": {\n      \"position\": \"relative\"\n    }\n  }, mdx(\"a\", {\n    parentName: \"h3\",\n    \"href\": \"#adding-depth-and-realism-with-generative-voice-ai\",\n    \"aria-label\": \"adding depth and realism with generative voice ai permalink\",\n    \"className\": \"anchor before\"\n  }, mdx(\"svg\", {\n    parentName: \"a\",\n    \"xmlns\": \"http://www.w3.org/2000/svg\",\n    \"width\": \"16\",\n    \"height\": \"16\",\n    \"focusable\": \"false\",\n    \"viewBox\": \"0 0 16 16\"\n  }, \"\\n  \", mdx(\"path\", {\n    parentName: \"svg\",\n    \"fill\": \"currentColor\",\n    \"d\": \"M4.441 7.38l.095.083.939.939-.708.707-.939-.939-2 2-.132.142a2.829 2.829 0 003.99 3.99l.142-.132 2-2-.939-.939.707-.708.94.94a1 1 0 01.083 1.32l-.083.094-2 2A3.828 3.828 0 01.972 9.621l.15-.158 2-2A1 1 0 014.34 7.31l.101.07zm7.413-3.234a.5.5 0 01.057.638l-.057.07-7 7a.5.5 0 01-.765-.638l.057-.07 7-7a.5.5 0 01.708 0zm3.023-3.025a3.829 3.829 0 01.15 5.257l-.15.158-2 2a1 1 0 01-1.32.083l-.094-.083-.94-.94.708-.707.939.94 2-2 .132-.142a2.829 2.829 0 00-3.99-3.99l-.142.131-2 2 .939.939-.707.708-.94-.94a1 1 0 01-.082-1.32l.083-.094 2-2a3.828 3.828 0 015.414 0z\"\n  }))), \"Adding Depth and Realism with Generative Voice AI\"), mdx(\"p\", null, \"XTTS leverages cutting-edge Generative Voice AI technology to create convincing, engaging,\\nand expressive voice overs. Using Generative Voice AI for game characters has never been\\nso simple or so potent. The voices that XTTS creates are rich with emotion, personality,\\nand realism, setting the standard for in-game vocal performance.\"), mdx(\"p\", null, \"The unique power of XTTS is its ability to give \", mdx(\"em\", {\n    parentName: \"p\"\n  }, \"voice\"), \" to characters, each one individually\\nnuanced and emotionally responsive. Now, your characters can whisper, shout, cry, laugh,\\nor express any shade of emotion in between!\"), mdx(\"div\", {\n    align: \"center\"\n  }, mdx(Link, {\n    to: \"https://app.coqui.ai/auth/signup\",\n    mdxType: \"Link\"\n  }, mdx(\"p\", null, mdx(\"span\", {\n    parentName: \"p\",\n    \"className\": \"gatsby-resp-image-wrapper\",\n    \"style\": {\n      \"position\": \"relative\",\n      \"display\": \"block\",\n      \"marginLeft\": \"auto\",\n      \"marginRight\": \"auto\",\n      \"maxWidth\": \"137px\"\n    }\n  }, \"\\n      \", mdx(\"span\", {\n    parentName: \"span\",\n    \"className\": \"gatsby-resp-image-background-image\",\n    \"style\": {\n      \"paddingBottom\": \"34.306569343065696%\",\n      \"position\": \"relative\",\n      \"bottom\": \"0\",\n      \"left\": \"0\",\n      \"display\": \"block\"\n    }\n  }), \"\\n  \", mdx(\"img\", {\n    parentName: \"span\",\n    \"className\": \"gatsby-resp-image-image\",\n    \"alt\": \"IMAGE\",\n    \"title\": \"IMAGE\",\n    \"src\": \"/static/0addc085d063dac762fd9b75a388f199/3f2c9/blog-unleashing-the-power-of-xtt-try-now-for-free.png\",\n    \"srcSet\": [\"/static/0addc085d063dac762fd9b75a388f199/3f2c9/blog-unleashing-the-power-of-xtt-try-now-for-free.png 137w\"],\n    \"sizes\": \"(max-width: 137px) 100vw, 137px\",\n    \"style\": {\n      \"width\": \"100%\",\n      \"height\": \"100%\",\n      \"margin\": \"0\",\n      \"verticalAlign\": \"middle\",\n      \"position\": \"absolute\",\n      \"top\": \"0\",\n      \"left\": \"0\"\n    },\n    \"loading\": \"lazy\"\n  }), \"\\n    \")))), mdx(\"h3\", {\n    \"id\": \"ease-of-use-and-customization-power-at-your-fingertips\",\n    \"style\": {\n      \"position\": \"relative\"\n    }\n  }, mdx(\"a\", {\n    parentName: \"h3\",\n    \"href\": \"#ease-of-use-and-customization-power-at-your-fingertips\",\n    \"aria-label\": \"ease of use and customization power at your fingertips permalink\",\n    \"className\": \"anchor before\"\n  }, mdx(\"svg\", {\n    parentName: \"a\",\n    \"xmlns\": \"http://www.w3.org/2000/svg\",\n    \"width\": \"16\",\n    \"height\": \"16\",\n    \"focusable\": \"false\",\n    \"viewBox\": \"0 0 16 16\"\n  }, \"\\n  \", mdx(\"path\", {\n    parentName: \"svg\",\n    \"fill\": \"currentColor\",\n    \"d\": \"M4.441 7.38l.095.083.939.939-.708.707-.939-.939-2 2-.132.142a2.829 2.829 0 003.99 3.99l.142-.132 2-2-.939-.939.707-.708.94.94a1 1 0 01.083 1.32l-.083.094-2 2A3.828 3.828 0 01.972 9.621l.15-.158 2-2A1 1 0 014.34 7.31l.101.07zm7.413-3.234a.5.5 0 01.057.638l-.057.07-7 7a.5.5 0 01-.765-.638l.057-.07 7-7a.5.5 0 01.708 0zm3.023-3.025a3.829 3.829 0 01.15 5.257l-.15.158-2 2a1 1 0 01-1.32.083l-.094-.083-.94-.94.708-.707.939.94 2-2 .132-.142a2.829 2.829 0 00-3.99-3.99l-.142.131-2 2 .939.939-.707.708-.94-.94a1 1 0 01-.082-1.32l.083-.094 2-2a3.828 3.828 0 015.414 0z\"\n  }))), \"Ease of Use and Customization: Power at Your Fingertips\"), mdx(\"p\", null, \"XTTS isn\\u2019t just advanced; it\\u2019s also easy to use and incredibly flexible. A user-friendly\\ninterface allowing you to create dialog in just a few clicks. Whether it\\u2019s a heart-wrenching\\ngoodbye, a moment of victory, or a tense stand-off, XTTS has got you covered.\"), mdx(\"p\", null, \"And there\\u2019s more! XTTS offers an array of customization options. For example, you can\\nadjust aspects like pace to create the perfect voice for each of your characters. This\\nfreedom and flexibility means your creativity is truly the limit with XTTS.\"), mdx(\"h3\", {\n    \"id\": \"the-transformative-potential-of-xtts-impacting-the-gaming-experience\",\n    \"style\": {\n      \"position\": \"relative\"\n    }\n  }, mdx(\"a\", {\n    parentName: \"h3\",\n    \"href\": \"#the-transformative-potential-of-xtts-impacting-the-gaming-experience\",\n    \"aria-label\": \"the transformative potential of xtts impacting the gaming experience permalink\",\n    \"className\": \"anchor before\"\n  }, mdx(\"svg\", {\n    parentName: \"a\",\n    \"xmlns\": \"http://www.w3.org/2000/svg\",\n    \"width\": \"16\",\n    \"height\": \"16\",\n    \"focusable\": \"false\",\n    \"viewBox\": \"0 0 16 16\"\n  }, \"\\n  \", mdx(\"path\", {\n    parentName: \"svg\",\n    \"fill\": \"currentColor\",\n    \"d\": \"M4.441 7.38l.095.083.939.939-.708.707-.939-.939-2 2-.132.142a2.829 2.829 0 003.99 3.99l.142-.132 2-2-.939-.939.707-.708.94.94a1 1 0 01.083 1.32l-.083.094-2 2A3.828 3.828 0 01.972 9.621l.15-.158 2-2A1 1 0 014.34 7.31l.101.07zm7.413-3.234a.5.5 0 01.057.638l-.057.07-7 7a.5.5 0 01-.765-.638l.057-.07 7-7a.5.5 0 01.708 0zm3.023-3.025a3.829 3.829 0 01.15 5.257l-.15.158-2 2a1 1 0 01-1.32.083l-.094-.083-.94-.94.708-.707.939.94 2-2 .132-.142a2.829 2.829 0 00-3.99-3.99l-.142.131-2 2 .939.939-.707.708-.94-.94a1 1 0 01-.082-1.32l.083-.094 2-2a3.828 3.828 0 015.414 0z\"\n  }))), \"The Transformative Potential of XTTS: Impacting the Gaming Experience\"), mdx(\"p\", null, \"By bringing life to your game characters, XTTS goes beyond merely enhancing your game.\\nIt revolutionizes the entire player experience. With XTTS, players are not just playing\\na game - they are living an immersive story filled with vivid, memorable characters.\\nIt is a tool that breathes life into your world and strengthens the emotional connections\\nbetween players and characters.\"), mdx(\"h3\", {\n    \"id\": \"invitation-to-experience-the-xtts-revolution\",\n    \"style\": {\n      \"position\": \"relative\"\n    }\n  }, mdx(\"a\", {\n    parentName: \"h3\",\n    \"href\": \"#invitation-to-experience-the-xtts-revolution\",\n    \"aria-label\": \"invitation to experience the xtts revolution permalink\",\n    \"className\": \"anchor before\"\n  }, mdx(\"svg\", {\n    parentName: \"a\",\n    \"xmlns\": \"http://www.w3.org/2000/svg\",\n    \"width\": \"16\",\n    \"height\": \"16\",\n    \"focusable\": \"false\",\n    \"viewBox\": \"0 0 16 16\"\n  }, \"\\n  \", mdx(\"path\", {\n    parentName: \"svg\",\n    \"fill\": \"currentColor\",\n    \"d\": \"M4.441 7.38l.095.083.939.939-.708.707-.939-.939-2 2-.132.142a2.829 2.829 0 003.99 3.99l.142-.132 2-2-.939-.939.707-.708.94.94a1 1 0 01.083 1.32l-.083.094-2 2A3.828 3.828 0 01.972 9.621l.15-.158 2-2A1 1 0 014.34 7.31l.101.07zm7.413-3.234a.5.5 0 01.057.638l-.057.07-7 7a.5.5 0 01-.765-.638l.057-.07 7-7a.5.5 0 01.708 0zm3.023-3.025a3.829 3.829 0 01.15 5.257l-.15.158-2 2a1 1 0 01-1.32.083l-.094-.083-.94-.94.708-.707.939.94 2-2 .132-.142a2.829 2.829 0 00-3.99-3.99l-.142.131-2 2 .939.939-.707.708-.94-.94a1 1 0 01-.082-1.32l.083-.094 2-2a3.828 3.828 0 015.414 0z\"\n  }))), \"Invitation to Experience the XTTS Revolution\"), mdx(\"p\", null, \"We invite you to experience the power of XTTS first-hand. Immerse yourself in the\\nastonishing realism it brings to your game characters. Once you\\u2019ve witnessed the magic of\\nXTTS, you\\u2019ll wonder how you ever managed without it.\"), mdx(\"p\", null, \"Remember, the world of XTTS is constantly evolving. We\\u2019re passionate about continuing to\\npush the boundaries of what\\u2019s possible with our Generative Voice AI. We welcome your feedback\\nand questions as we strive to make XTTS even better. Together, let\\u2019s continue to redefine the\\ngaming experience. Are you ready for the XTTS revolution? It\\u2019s time to start creating\\nunforgettable gaming experiences like never before!\"), mdx(\"div\", {\n    align: \"center\"\n  }, mdx(Link, {\n    to: \"https://app.coqui.ai/auth/signup\",\n    mdxType: \"Link\"\n  }, mdx(\"p\", null, mdx(\"span\", {\n    parentName: \"p\",\n    \"className\": \"gatsby-resp-image-wrapper\",\n    \"style\": {\n      \"position\": \"relative\",\n      \"display\": \"block\",\n      \"marginLeft\": \"auto\",\n      \"marginRight\": \"auto\",\n      \"maxWidth\": \"137px\"\n    }\n  }, \"\\n      \", mdx(\"span\", {\n    parentName: \"span\",\n    \"className\": \"gatsby-resp-image-background-image\",\n    \"style\": {\n      \"paddingBottom\": \"34.306569343065696%\",\n      \"position\": \"relative\",\n      \"bottom\": \"0\",\n      \"left\": \"0\",\n      \"display\": \"block\"\n    }\n  }), \"\\n  \", mdx(\"img\", {\n    parentName: \"span\",\n    \"className\": \"gatsby-resp-image-image\",\n    \"alt\": \"IMAGE\",\n    \"title\": \"IMAGE\",\n    \"src\": \"/static/0addc085d063dac762fd9b75a388f199/3f2c9/blog-unleashing-the-power-of-xtt-try-now-for-free.png\",\n    \"srcSet\": [\"/static/0addc085d063dac762fd9b75a388f199/3f2c9/blog-unleashing-the-power-of-xtt-try-now-for-free.png 137w\"],\n    \"sizes\": \"(max-width: 137px) 100vw, 137px\",\n    \"style\": {\n      \"width\": \"100%\",\n      \"height\": \"100%\",\n      \"margin\": \"0\",\n      \"verticalAlign\": \"middle\",\n      \"position\": \"absolute\",\n      \"top\": \"0\",\n      \"left\": \"0\"\n    },\n    \"loading\": \"lazy\"\n  }), \"\\n    \")))));\n}\n;\nMDXContent.isMDXComponent = true;","tableOfContents":{"items":[{"url":"#adding-depth-and-realism-with-generative-voice-ai","title":"Adding Depth and Realism with Generative Voice AI"},{"url":"#ease-of-use-and-customization-power-at-your-fingertips","title":"Ease of Use and Customization: Power at Your Fingertips"},{"url":"#the-transformative-potential-of-xtts-impacting-the-gaming-experience","title":"The Transformative Potential of XTTS: Impacting the Gaming Experience"},{"url":"#invitation-to-experience-the-xtts-revolution","title":"Invitation to Experience the XTTS Revolution"}]}}},"pageContext":{"frontmatter":{"title":"Unleashing the Power of XTTS: A Revolution in Gaming Immersion","name":"Team Coqui üê∏","picture":"https://avatars.githubusercontent.com/u/75583352?s=96&v=4","date":"August 9, 2023"},"fileAbsolutePath":"/home/runner/work/coqui-ai.github.io/coqui-ai.github.io/src/pages/blog/tts/unleashing_the_power_of_xtts.mdx"}},"staticQueryHashes":["1942088059","3709355695"]}