{"componentChunkName":"component---src-pages-blog-tts-african-languages-dataset-collaboration-mdx","path":"/blog/tts/african-languages-dataset-collaboration","result":{"data":{"mdx":{"id":"04c85bf5-d2d7-5262-ae9a-3a09a7d41bcb","excerpt":"ðŸ‘‰  Try out the new African TTS models! Introduction Over the course of several months, researchers from Coqui collaborated with a globalâ€¦","body":"var _excluded = [\"components\"];\n\nvar _templateObject;\n\nfunction _extends() { _extends = Object.assign ? Object.assign.bind() : function (target) { for (var i = 1; i < arguments.length; i++) { var source = arguments[i]; for (var key in source) { if (Object.prototype.hasOwnProperty.call(source, key)) { target[key] = source[key]; } } } return target; }; return _extends.apply(this, arguments); }\n\nfunction _objectWithoutProperties(source, excluded) { if (source == null) return {}; var target = _objectWithoutPropertiesLoose(source, excluded); var key, i; if (Object.getOwnPropertySymbols) { var sourceSymbolKeys = Object.getOwnPropertySymbols(source); for (i = 0; i < sourceSymbolKeys.length; i++) { key = sourceSymbolKeys[i]; if (excluded.indexOf(key) >= 0) continue; if (!Object.prototype.propertyIsEnumerable.call(source, key)) continue; target[key] = source[key]; } } return target; }\n\nfunction _objectWithoutPropertiesLoose(source, excluded) { if (source == null) return {}; var target = {}; var sourceKeys = Object.keys(source); var key, i; for (i = 0; i < sourceKeys.length; i++) { key = sourceKeys[i]; if (excluded.indexOf(key) >= 0) continue; target[key] = source[key]; } return target; }\n\nfunction _taggedTemplateLiteral(strings, raw) { if (!raw) { raw = strings.slice(0); } return Object.freeze(Object.defineProperties(strings, { raw: { value: Object.freeze(raw) } })); }\n\n/* @jsxRuntime classic */\n\n/* @jsx mdx */\nvar pageQuery = graphql(_templateObject || (_templateObject = _taggedTemplateLiteral([\"\\n  query($fileAbsolutePath: String) {\\n    ...SidebarPageFragment\\n  }\\n\"])));\nvar _frontmatter = {\n  \"title\": \"Data and models for African langauges\",\n  \"name\": \"Josh Meyer\",\n  \"picture\": \"https://avatars.githubusercontent.com/u/8389864?v=4\",\n  \"date\": \"May 2, 2022\"\n};\nvar layoutProps = {\n  pageQuery: pageQuery,\n  _frontmatter: _frontmatter\n};\nvar MDXLayout = \"wrapper\";\nreturn function MDXContent(_ref) {\n  var components = _ref.components,\n      props = _objectWithoutProperties(_ref, _excluded);\n\n  return mdx(MDXLayout, _extends({}, layoutProps, props, {\n    components: components,\n    mdxType: \"MDXLayout\"\n  }), mdx(\"p\", null, \"\\uD83D\\uDC49 \", mdx(\"a\", {\n    parentName: \"p\",\n    \"href\": \"https://huggingface.co/spaces/coqui/CoquiTTS\"\n  }, \"Try out the new African TTS models!\")), mdx(\"h3\", {\n    \"id\": \"introduction\",\n    \"style\": {\n      \"position\": \"relative\"\n    }\n  }, mdx(\"a\", {\n    parentName: \"h3\",\n    \"href\": \"#introduction\",\n    \"aria-label\": \"introduction permalink\",\n    \"className\": \"anchor before\"\n  }, mdx(\"svg\", {\n    parentName: \"a\",\n    \"xmlns\": \"http://www.w3.org/2000/svg\",\n    \"width\": \"16\",\n    \"height\": \"16\",\n    \"focusable\": \"false\",\n    \"viewBox\": \"0 0 16 16\"\n  }, \"\\n  \", mdx(\"path\", {\n    parentName: \"svg\",\n    \"fill\": \"currentColor\",\n    \"d\": \"M4.441 7.38l.095.083.939.939-.708.707-.939-.939-2 2-.132.142a2.829 2.829 0 003.99 3.99l.142-.132 2-2-.939-.939.707-.708.94.94a1 1 0 01.083 1.32l-.083.094-2 2A3.828 3.828 0 01.972 9.621l.15-.158 2-2A1 1 0 014.34 7.31l.101.07zm7.413-3.234a.5.5 0 01.057.638l-.057.07-7 7a.5.5 0 01-.765-.638l.057-.07 7-7a.5.5 0 01.708 0zm3.023-3.025a3.829 3.829 0 01.15 5.257l-.15.158-2 2a1 1 0 01-1.32.083l-.094-.083-.94-.94.708-.707.939.94 2-2 .132-.142a2.829 2.829 0 00-3.99-3.99l-.142.131-2 2 .939.939-.707.708-.94-.94a1 1 0 01-.082-1.32l.083-.094 2-2a3.828 3.828 0 015.414 0z\"\n  }))), \"Introduction\"), mdx(\"p\", null, \"Over the course of several months, researchers from Coqui collaborated with a global team of academics, language\\nactivists, and technologists in order to create high quality Text-to-Speech for six African languages. This blog post\\ncovers who this excellent team was, what we did, and how you can use these new voices for yourself. All the synthetic\\nvoices discussed here are available under a Creative Commons BY-SA 4.0 License \\u2014 a free, open, and commercial friendly\\nlicense.\"), mdx(\"p\", null, \"There are literally thousands of languages spoken in Africa, and as such this current work is only the tip of the\\niceberg. Nevertheless, we hope our work inspires others to create new open, synthetic voices for as many of Africa\\u2019s\\nlanguages as possible. Coqui\\u2019s TTS can be fine-tuned to any new language, even with tiny amounts of data, regardless\\nof the alphabet or grammar or linguistic attributes. The more data the better, as you will see (and hear) here. Data\\nis almost always the bottleneck in deep learning, and in this blogpost we\\u2019ll discuss how we found raw data that wasn\\u2019t\\nready for TTS, and massaged it into a place where beautiful, high-fidelity synthetic voices could be built. Once the\\ndata was ready, training the models was a piece of cake.\"), mdx(\"p\", null, \"This project wouldn\\u2019t have been possible without our collaborators. Specifically, the excellent Masakhane NLP community\\nis what brought us all together in the first place. We eagerly look forward to more Coqui + Masakhane collaborations\\nin the future! If you want to see the future of natural language technology (especially for African languages),\\n\", mdx(\"a\", {\n    parentName: \"p\",\n    \"href\": \"https://www.masakhane.io/\"\n  }, \"Masakhane\"), \" is the place to be.\"), mdx(\"h3\", {\n    \"id\": \"collaborators\",\n    \"style\": {\n      \"position\": \"relative\"\n    }\n  }, mdx(\"a\", {\n    parentName: \"h3\",\n    \"href\": \"#collaborators\",\n    \"aria-label\": \"collaborators permalink\",\n    \"className\": \"anchor before\"\n  }, mdx(\"svg\", {\n    parentName: \"a\",\n    \"xmlns\": \"http://www.w3.org/2000/svg\",\n    \"width\": \"16\",\n    \"height\": \"16\",\n    \"focusable\": \"false\",\n    \"viewBox\": \"0 0 16 16\"\n  }, \"\\n  \", mdx(\"path\", {\n    parentName: \"svg\",\n    \"fill\": \"currentColor\",\n    \"d\": \"M4.441 7.38l.095.083.939.939-.708.707-.939-.939-2 2-.132.142a2.829 2.829 0 003.99 3.99l.142-.132 2-2-.939-.939.707-.708.94.94a1 1 0 01.083 1.32l-.083.094-2 2A3.828 3.828 0 01.972 9.621l.15-.158 2-2A1 1 0 014.34 7.31l.101.07zm7.413-3.234a.5.5 0 01.057.638l-.057.07-7 7a.5.5 0 01-.765-.638l.057-.07 7-7a.5.5 0 01.708 0zm3.023-3.025a3.829 3.829 0 01.15 5.257l-.15.158-2 2a1 1 0 01-1.32.083l-.094-.083-.94-.94.708-.707.939.94 2-2 .132-.142a2.829 2.829 0 00-3.99-3.99l-.142.131-2 2 .939.939-.707.708-.94-.94a1 1 0 01-.082-1.32l.083-.094 2-2a3.828 3.828 0 015.414 0z\"\n  }))), \"Collaborators\"), mdx(\"p\", null, \"Without further ado, here\\u2019s the team of individuals that brought these voices into reality (in alphabetical order):\"), mdx(\"ul\", null, mdx(\"li\", {\n    parentName: \"ul\"\n  }, \"Alp \\xD6ktem, Apelete Agbolo, Bernard Opoku, Chris Emezue, Colin Leong, Daniel Whitenack, David Ifeoluwa Adelani,\\nEdresson Casanova, Elizabeth Salesky, Iroro Orife, Jesujoba Alabi, Jonathan Mukiibi, Josh Meyer, Julian Weber, Perez\\nOgayo, Salomey Osei, Salomon Kabongo, Samuel Olanrewaju, Shamsuddeen Muhammad, Victor Akinode\")), mdx(\"p\", null, \"Featuring activists and technologists from:\"), mdx(\"ul\", null, mdx(\"li\", {\n    parentName: \"ul\"\n  }, \"CLEAR Global, Col\\xB7lectivaT, Ewegbe Akademi, Masakhane, Niger-Volta LTI, SIL International\")), mdx(\"p\", null, \"Featuring academic researchers from:\"), mdx(\"ul\", null, mdx(\"li\", {\n    parentName: \"ul\"\n  }, \"Carnegie Mellon University, Johns Hopkins University, Kwame Nkrumah University of Science and Technology, Leibniz\\nUniversit\\xE4t, Makerere University, Saarland University, Technical University of Munich, University of S\\xE3o Paulo\")), mdx(\"h3\", {\n    \"id\": \"the-languages\",\n    \"style\": {\n      \"position\": \"relative\"\n    }\n  }, mdx(\"a\", {\n    parentName: \"h3\",\n    \"href\": \"#the-languages\",\n    \"aria-label\": \"the languages permalink\",\n    \"className\": \"anchor before\"\n  }, mdx(\"svg\", {\n    parentName: \"a\",\n    \"xmlns\": \"http://www.w3.org/2000/svg\",\n    \"width\": \"16\",\n    \"height\": \"16\",\n    \"focusable\": \"false\",\n    \"viewBox\": \"0 0 16 16\"\n  }, \"\\n  \", mdx(\"path\", {\n    parentName: \"svg\",\n    \"fill\": \"currentColor\",\n    \"d\": \"M4.441 7.38l.095.083.939.939-.708.707-.939-.939-2 2-.132.142a2.829 2.829 0 003.99 3.99l.142-.132 2-2-.939-.939.707-.708.94.94a1 1 0 01.083 1.32l-.083.094-2 2A3.828 3.828 0 01.972 9.621l.15-.158 2-2A1 1 0 014.34 7.31l.101.07zm7.413-3.234a.5.5 0 01.057.638l-.057.07-7 7a.5.5 0 01-.765-.638l.057-.07 7-7a.5.5 0 01.708 0zm3.023-3.025a3.829 3.829 0 01.15 5.257l-.15.158-2 2a1 1 0 01-1.32.083l-.094-.083-.94-.94.708-.707.939.94 2-2 .132-.142a2.829 2.829 0 00-3.99-3.99l-.142.131-2 2 .939.939-.707.708-.94-.94a1 1 0 01-.082-1.32l.083-.094 2-2a3.828 3.828 0 015.414 0z\"\n  }))), \"The Languages\"), mdx(\"p\", null, \"The six new languages added to TTS are:\"), mdx(\"table\", null, mdx(\"thead\", {\n    parentName: \"table\"\n  }, mdx(\"tr\", {\n    parentName: \"thead\"\n  }, mdx(\"th\", {\n    parentName: \"tr\",\n    \"align\": null\n  }, \"Language\"), mdx(\"th\", {\n    parentName: \"tr\",\n    \"align\": null\n  }, \"Classification\"), mdx(\"th\", {\n    parentName: \"tr\",\n    \"align\": null\n  }, \"African region\"), mdx(\"th\", {\n    parentName: \"tr\",\n    \"align\": null\n  }, \"Number of Speakers\"), mdx(\"th\", {\n    parentName: \"tr\",\n    \"align\": null\n  }))), mdx(\"tbody\", {\n    parentName: \"table\"\n  }, mdx(\"tr\", {\n    parentName: \"tbody\"\n  }, mdx(\"td\", {\n    parentName: \"tr\",\n    \"align\": null\n  }, \"Ewe\"), mdx(\"td\", {\n    parentName: \"tr\",\n    \"align\": null\n  }, \"Niger-Congo / Kwa\"), mdx(\"td\", {\n    parentName: \"tr\",\n    \"align\": null\n  }, \"West\"), mdx(\"td\", {\n    parentName: \"tr\",\n    \"align\": null\n  }, \"5.5M\"), mdx(\"td\", {\n    parentName: \"tr\",\n    \"align\": null\n  })), mdx(\"tr\", {\n    parentName: \"tbody\"\n  }, mdx(\"td\", {\n    parentName: \"tr\",\n    \"align\": null\n  }, \"Hausa\"), mdx(\"td\", {\n    parentName: \"tr\",\n    \"align\": null\n  }, \"Afro-Asiatic / Chadic\"), mdx(\"td\", {\n    parentName: \"tr\",\n    \"align\": null\n  }, \"West\"), mdx(\"td\", {\n    parentName: \"tr\",\n    \"align\": null\n  }, \"77M\"), mdx(\"td\", {\n    parentName: \"tr\",\n    \"align\": null\n  })), mdx(\"tr\", {\n    parentName: \"tbody\"\n  }, mdx(\"td\", {\n    parentName: \"tr\",\n    \"align\": null\n  }, \"Lingala\"), mdx(\"td\", {\n    parentName: \"tr\",\n    \"align\": null\n  }, \"Niger-Congo / Bantu\"), mdx(\"td\", {\n    parentName: \"tr\",\n    \"align\": null\n  }, \"Central\"), mdx(\"td\", {\n    parentName: \"tr\",\n    \"align\": null\n  }, \"40M\"), mdx(\"td\", {\n    parentName: \"tr\",\n    \"align\": null\n  })), mdx(\"tr\", {\n    parentName: \"tbody\"\n  }, mdx(\"td\", {\n    parentName: \"tr\",\n    \"align\": null\n  }, \"Akuapem Twi\"), mdx(\"td\", {\n    parentName: \"tr\",\n    \"align\": null\n  }, \"Niger-Congo / Akan\"), mdx(\"td\", {\n    parentName: \"tr\",\n    \"align\": null\n  }, \"West\"), mdx(\"td\", {\n    parentName: \"tr\",\n    \"align\": null\n  }, \"626k\"), mdx(\"td\", {\n    parentName: \"tr\",\n    \"align\": null\n  })), mdx(\"tr\", {\n    parentName: \"tbody\"\n  }, mdx(\"td\", {\n    parentName: \"tr\",\n    \"align\": null\n  }, \"Asante Twi\"), mdx(\"td\", {\n    parentName: \"tr\",\n    \"align\": null\n  }, \"Niger-Congo / Akan\"), mdx(\"td\", {\n    parentName: \"tr\",\n    \"align\": null\n  }, \"West\"), mdx(\"td\", {\n    parentName: \"tr\",\n    \"align\": null\n  }, \"3.8M\"), mdx(\"td\", {\n    parentName: \"tr\",\n    \"align\": null\n  })), mdx(\"tr\", {\n    parentName: \"tbody\"\n  }, mdx(\"td\", {\n    parentName: \"tr\",\n    \"align\": null\n  }, \"Yoruba\"), mdx(\"td\", {\n    parentName: \"tr\",\n    \"align\": null\n  }, \"Niger-Congo / Volta-Niger\"), mdx(\"td\", {\n    parentName: \"tr\",\n    \"align\": null\n  }, \"West\"), mdx(\"td\", {\n    parentName: \"tr\",\n    \"align\": null\n  }, \"46M\"), mdx(\"td\", {\n    parentName: \"tr\",\n    \"align\": null\n  })))), mdx(\"p\", null, \"Both the \\u201CNumber of Speakers\\u201D and \\u201CClassification\\u201D columns come from Ethnologue. These six languages are all\\n\", mdx(\"a\", {\n    parentName: \"p\",\n    \"href\": \"https://en.wikipedia.org/wiki/Tone_(linguistics)\"\n  }, \"tonal\"), \", come from two of the largest language families in Africa\\n(Niger-Congo and Afro-Asiatic), and are spoken primarily in Central and West Africa. Needless to say, there are a lot\\nof people speaking these languages in a huge geographic area. By releasing these models under an open Creative Commons\\nlicense, we hope they will be immediately useful to speakers of these languages.\"), mdx(\"h3\", {\n    \"id\": \"the-collaboration-story\",\n    \"style\": {\n      \"position\": \"relative\"\n    }\n  }, mdx(\"a\", {\n    parentName: \"h3\",\n    \"href\": \"#the-collaboration-story\",\n    \"aria-label\": \"the collaboration story permalink\",\n    \"className\": \"anchor before\"\n  }, mdx(\"svg\", {\n    parentName: \"a\",\n    \"xmlns\": \"http://www.w3.org/2000/svg\",\n    \"width\": \"16\",\n    \"height\": \"16\",\n    \"focusable\": \"false\",\n    \"viewBox\": \"0 0 16 16\"\n  }, \"\\n  \", mdx(\"path\", {\n    parentName: \"svg\",\n    \"fill\": \"currentColor\",\n    \"d\": \"M4.441 7.38l.095.083.939.939-.708.707-.939-.939-2 2-.132.142a2.829 2.829 0 003.99 3.99l.142-.132 2-2-.939-.939.707-.708.94.94a1 1 0 01.083 1.32l-.083.094-2 2A3.828 3.828 0 01.972 9.621l.15-.158 2-2A1 1 0 014.34 7.31l.101.07zm7.413-3.234a.5.5 0 01.057.638l-.057.07-7 7a.5.5 0 01-.765-.638l.057-.07 7-7a.5.5 0 01.708 0zm3.023-3.025a3.829 3.829 0 01.15 5.257l-.15.158-2 2a1 1 0 01-1.32.083l-.094-.083-.94-.94.708-.707.939.94 2-2 .132-.142a2.829 2.829 0 00-3.99-3.99l-.142.131-2 2 .939.939-.707.708-.94-.94a1 1 0 01-.082-1.32l.083-.094 2-2a3.828 3.828 0 015.414 0z\"\n  }))), \"The Collaboration Story\"), mdx(\"p\", null, \"As with all machine learning projects, data is the starting point. This entire collaboration spawned from a short URL\\nposted into a chatroom: \", mdx(\"a\", {\n    parentName: \"p\",\n    \"href\": \"https://open.bible\"\n  }, \"open.bible\"), \". A researcher from Coqui was hanging out with the folks from\\nMasakhane in their slack group when someone posted the link saying something like \\u201Clooks like some cool data!\\u201C. In no\\ntime at all, a lively discussion ensued. The data was absolutely beautiful. All the data was explicitly licensed under\\nCC-BY-SA, made of hours and hours of high-quality recordings from professional voice actors. This was without\\nexaggeration the highest-quality voice data for speech synthesis Coqui had ever found in the open \\u2014 for any language.\"), mdx(\"p\", null, \"There was only one problem \\u2014 the original audio files are too long for training TTS models. The audio was saved as\\nchapters (from the Bible), which were several minutes long each. It\\u2019s best to train synthetic voices with audio clips\\nunder 30 seconds long, so we couldn\\u2019t use the data out of the box. The intuitively simple task of breaking chapters\\ninto verses is not so simple in practice, and it requires significant compute power. Nevertheless, over a couple months\\nand more than a couple cups of coffee, we aligned the recordings to the verse-level, and then we extracted only the\\nbest data. The resulting datasets will be released under the same CC-BY-SA 4.0 license, as well as our research paper\\ndetailing how we made it possible. Both the dataset release and publication of our methods are slated for INTERSPEECH 2022.\"), mdx(\"h3\", {\n    \"id\": \"use-the-models\",\n    \"style\": {\n      \"position\": \"relative\"\n    }\n  }, mdx(\"a\", {\n    parentName: \"h3\",\n    \"href\": \"#use-the-models\",\n    \"aria-label\": \"use the models permalink\",\n    \"className\": \"anchor before\"\n  }, mdx(\"svg\", {\n    parentName: \"a\",\n    \"xmlns\": \"http://www.w3.org/2000/svg\",\n    \"width\": \"16\",\n    \"height\": \"16\",\n    \"focusable\": \"false\",\n    \"viewBox\": \"0 0 16 16\"\n  }, \"\\n  \", mdx(\"path\", {\n    parentName: \"svg\",\n    \"fill\": \"currentColor\",\n    \"d\": \"M4.441 7.38l.095.083.939.939-.708.707-.939-.939-2 2-.132.142a2.829 2.829 0 003.99 3.99l.142-.132 2-2-.939-.939.707-.708.94.94a1 1 0 01.083 1.32l-.083.094-2 2A3.828 3.828 0 01.972 9.621l.15-.158 2-2A1 1 0 014.34 7.31l.101.07zm7.413-3.234a.5.5 0 01.057.638l-.057.07-7 7a.5.5 0 01-.765-.638l.057-.07 7-7a.5.5 0 01.708 0zm3.023-3.025a3.829 3.829 0 01.15 5.257l-.15.158-2 2a1 1 0 01-1.32.083l-.094-.083-.94-.94.708-.707.939.94 2-2 .132-.142a2.829 2.829 0 00-3.99-3.99l-.142.131-2 2 .939.939-.707.708-.94-.94a1 1 0 01-.082-1.32l.083-.094 2-2a3.828 3.828 0 015.414 0z\"\n  }))), \"Use the Models\"), mdx(\"p\", null, \"All models discussed here can be used from:\"), mdx(\"ol\", null, mdx(\"li\", {\n    parentName: \"ol\"\n  }, \"Our official \", mdx(\"a\", {\n    parentName: \"li\",\n    \"href\": \"https://huggingface.co/spaces/coqui/CoquiTTS\"\n  }, \"Coqui Huggingface space\")), mdx(\"li\", {\n    parentName: \"ol\"\n  }, \"Your browser with \", mdx(\"a\", {\n    parentName: \"li\",\n    \"href\": \"https://tts.readthedocs.io/en/latest/inference.html#on-the-demo-server-tts-server\"\n  }, mdx(\"inlineCode\", {\n    parentName: \"a\"\n  }, \"tts-server\"))), mdx(\"li\", {\n    parentName: \"ol\"\n  }, \"Your command line with \", mdx(\"a\", {\n    parentName: \"li\",\n    \"href\": \"https://tts.readthedocs.io/en/latest/inference.html#on-the-commandline-tts\"\n  }, mdx(\"inlineCode\", {\n    parentName: \"a\"\n  }, \"tts\")))), mdx(\"h3\", {\n    \"id\": \"conclusion\",\n    \"style\": {\n      \"position\": \"relative\"\n    }\n  }, mdx(\"a\", {\n    parentName: \"h3\",\n    \"href\": \"#conclusion\",\n    \"aria-label\": \"conclusion permalink\",\n    \"className\": \"anchor before\"\n  }, mdx(\"svg\", {\n    parentName: \"a\",\n    \"xmlns\": \"http://www.w3.org/2000/svg\",\n    \"width\": \"16\",\n    \"height\": \"16\",\n    \"focusable\": \"false\",\n    \"viewBox\": \"0 0 16 16\"\n  }, \"\\n  \", mdx(\"path\", {\n    parentName: \"svg\",\n    \"fill\": \"currentColor\",\n    \"d\": \"M4.441 7.38l.095.083.939.939-.708.707-.939-.939-2 2-.132.142a2.829 2.829 0 003.99 3.99l.142-.132 2-2-.939-.939.707-.708.94.94a1 1 0 01.083 1.32l-.083.094-2 2A3.828 3.828 0 01.972 9.621l.15-.158 2-2A1 1 0 014.34 7.31l.101.07zm7.413-3.234a.5.5 0 01.057.638l-.057.07-7 7a.5.5 0 01-.765-.638l.057-.07 7-7a.5.5 0 01.708 0zm3.023-3.025a3.829 3.829 0 01.15 5.257l-.15.158-2 2a1 1 0 01-1.32.083l-.094-.083-.94-.94.708-.707.939.94 2-2 .132-.142a2.829 2.829 0 00-3.99-3.99l-.142.131-2 2 .939.939-.707.708-.94-.94a1 1 0 01-.082-1.32l.083-.094 2-2a3.828 3.828 0 015.414 0z\"\n  }))), \"Conclusion\"), mdx(\"p\", null, \"Keep an eye our for our INTERSPEECH paper for all the technical details on how we created the datasets and trained the\\nmodels. Until then, take the models and do something great! We want to thank again all the folks who helped make this\\npossible, especially the Masakhane community for bringing us all together. We want to also acknowledge the individuals\\nwho spent hours and hours narrarating the Bible in these languages for the Open.Bible project, and for releasing the\\nrecordings under a Creative Commons license in the first place. We also want to thank the team of folks at Biblica for\\ntaking such care to record, organize, and release the raw data. They did not participate in this research, but it would\\nnot have been possible without them. On a last, but important note, anyone using these synthetic voices should be using\\nthem to create more good in the world, and no more harm. Out of respect to the original voice actors and the nature of\\nthe original recordings, we want the voices to be used to help people, and we\\u2019re sure they can find great use in places\\nlike education and accessibility. For example, these voices can easily be used to create audiobooks for people who can\\u2019t\\nsee or read well, and make reading more fun for students. If you use these models, let us know what great things you\\u2019re\\ncreating in the world!\"));\n}\n;\nMDXContent.isMDXComponent = true;","tableOfContents":{"items":[{"url":"#introduction","title":"Introduction"},{"url":"#collaborators","title":"Collaborators"},{"url":"#the-languages","title":"The Languages"},{"url":"#the-collaboration-story","title":"The Collaboration Story"},{"url":"#use-the-models","title":"Use the Models"},{"url":"#conclusion","title":"Conclusion"}]}}},"pageContext":{"frontmatter":{"title":"Data and models for African langauges","name":"Josh Meyer","picture":"https://avatars.githubusercontent.com/u/8389864?v=4","date":"May 2, 2022"},"fileAbsolutePath":"/home/runner/work/coqui-ai.github.io/coqui-ai.github.io/src/pages/blog/tts/african-languages-dataset-collaboration.mdx"}},"staticQueryHashes":["1942088059","3709355695"]}