{"componentChunkName":"component---src-pages-blog-tts-prompt-to-voice-mdx","path":"/blog/tts/prompt-to-voice","result":{"data":{"mdx":{"id":"fda84910-0c7a-515a-8290-ff63bcd90485","excerpt":"Coqui Studio: The Studio for Generative AI Voice Coqui Studio is an AI voice directing platform that allows users to generate, clone, and…","body":"var _excluded = [\"components\"];\n\nvar _templateObject;\n\nfunction _extends() { _extends = Object.assign ? Object.assign.bind() : function (target) { for (var i = 1; i < arguments.length; i++) { var source = arguments[i]; for (var key in source) { if (Object.prototype.hasOwnProperty.call(source, key)) { target[key] = source[key]; } } } return target; }; return _extends.apply(this, arguments); }\n\nfunction _objectWithoutProperties(source, excluded) { if (source == null) return {}; var target = _objectWithoutPropertiesLoose(source, excluded); var key, i; if (Object.getOwnPropertySymbols) { var sourceSymbolKeys = Object.getOwnPropertySymbols(source); for (i = 0; i < sourceSymbolKeys.length; i++) { key = sourceSymbolKeys[i]; if (excluded.indexOf(key) >= 0) continue; if (!Object.prototype.propertyIsEnumerable.call(source, key)) continue; target[key] = source[key]; } } return target; }\n\nfunction _objectWithoutPropertiesLoose(source, excluded) { if (source == null) return {}; var target = {}; var sourceKeys = Object.keys(source); var key, i; for (i = 0; i < sourceKeys.length; i++) { key = sourceKeys[i]; if (excluded.indexOf(key) >= 0) continue; target[key] = source[key]; } return target; }\n\nfunction _taggedTemplateLiteral(strings, raw) { if (!raw) { raw = strings.slice(0); } return Object.freeze(Object.defineProperties(strings, { raw: { value: Object.freeze(raw) } })); }\n\n/* @jsxRuntime classic */\n\n/* @jsx mdx */\nvar pageQuery = graphql(_templateObject || (_templateObject = _taggedTemplateLiteral([\"\\n  query($fileAbsolutePath: String) {\\n    ...SidebarPageFragment\\n  }\\n\"])));\nvar _frontmatter = {\n  \"title\": \"Introducing Prompt-to-Voice - Describe It to Hear It\",\n  \"name\": \"Eren Gölge and Kelly Davis\",\n  \"picture\": \"https://avatars.githubusercontent.com/u/75583352?s=96&v=4\",\n  \"date\": \"Feb 17, 2022\"\n};\nvar layoutProps = {\n  pageQuery: pageQuery,\n  _frontmatter: _frontmatter\n};\nvar MDXLayout = \"wrapper\";\nreturn function MDXContent(_ref) {\n  var components = _ref.components,\n      props = _objectWithoutProperties(_ref, _excluded);\n\n  return mdx(MDXLayout, _extends({}, layoutProps, props, {\n    components: components,\n    mdxType: \"MDXLayout\"\n  }), mdx(\"h3\", {\n    \"id\": \"coqui-studio-the-studio-for-generative-ai-voice\",\n    \"style\": {\n      \"position\": \"relative\"\n    }\n  }, mdx(\"a\", {\n    parentName: \"h3\",\n    \"href\": \"#coqui-studio-the-studio-for-generative-ai-voice\",\n    \"aria-label\": \"coqui studio the studio for generative ai voice permalink\",\n    \"className\": \"anchor before\"\n  }, mdx(\"svg\", {\n    parentName: \"a\",\n    \"xmlns\": \"http://www.w3.org/2000/svg\",\n    \"width\": \"16\",\n    \"height\": \"16\",\n    \"focusable\": \"false\",\n    \"viewBox\": \"0 0 16 16\"\n  }, \"\\n  \", mdx(\"path\", {\n    parentName: \"svg\",\n    \"fill\": \"currentColor\",\n    \"d\": \"M4.441 7.38l.095.083.939.939-.708.707-.939-.939-2 2-.132.142a2.829 2.829 0 003.99 3.99l.142-.132 2-2-.939-.939.707-.708.94.94a1 1 0 01.083 1.32l-.083.094-2 2A3.828 3.828 0 01.972 9.621l.15-.158 2-2A1 1 0 014.34 7.31l.101.07zm7.413-3.234a.5.5 0 01.057.638l-.057.07-7 7a.5.5 0 01-.765-.638l.057-.07 7-7a.5.5 0 01.708 0zm3.023-3.025a3.829 3.829 0 01.15 5.257l-.15.158-2 2a1 1 0 01-1.32.083l-.094-.083-.94-.94.708-.707.939.94 2-2 .132-.142a2.829 2.829 0 00-3.99-3.99l-.142.131-2 2 .939.939-.707.708-.94-.94a1 1 0 01-.082-1.32l.083-.094 2-2a3.828 3.828 0 015.414 0z\"\n  }))), \"Coqui Studio: The Studio for Generative AI Voice\"), mdx(\"p\", null, \"Coqui Studio is an AI voice directing platform that allows users to generate, clone, and control AI voices\\nfor video games, audio post-production, dubbing, and more. It features a large set of generative AI voices,\\nan advanced editor for tuning each voice, tools for managing projects & scripts, and tons of tools for\\nediting timelines, all to help users streamline their workflow. We\\u2019re now beta-launching \\u201Cprompt-to-voice\\u201D,\\nan unprecedented way to generate unique voices.\"), mdx(\"h3\", {\n    \"id\": \"what-is-prompt-to-voice\",\n    \"style\": {\n      \"position\": \"relative\"\n    }\n  }, mdx(\"a\", {\n    parentName: \"h3\",\n    \"href\": \"#what-is-prompt-to-voice\",\n    \"aria-label\": \"what is prompt to voice permalink\",\n    \"className\": \"anchor before\"\n  }, mdx(\"svg\", {\n    parentName: \"a\",\n    \"xmlns\": \"http://www.w3.org/2000/svg\",\n    \"width\": \"16\",\n    \"height\": \"16\",\n    \"focusable\": \"false\",\n    \"viewBox\": \"0 0 16 16\"\n  }, \"\\n  \", mdx(\"path\", {\n    parentName: \"svg\",\n    \"fill\": \"currentColor\",\n    \"d\": \"M4.441 7.38l.095.083.939.939-.708.707-.939-.939-2 2-.132.142a2.829 2.829 0 003.99 3.99l.142-.132 2-2-.939-.939.707-.708.94.94a1 1 0 01.083 1.32l-.083.094-2 2A3.828 3.828 0 01.972 9.621l.15-.158 2-2A1 1 0 014.34 7.31l.101.07zm7.413-3.234a.5.5 0 01.057.638l-.057.07-7 7a.5.5 0 01-.765-.638l.057-.07 7-7a.5.5 0 01.708 0zm3.023-3.025a3.829 3.829 0 01.15 5.257l-.15.158-2 2a1 1 0 01-1.32.083l-.094-.083-.94-.94.708-.707.939.94 2-2 .132-.142a2.829 2.829 0 00-3.99-3.99l-.142.131-2 2 .939.939-.707.708-.94-.94a1 1 0 01-.082-1.32l.083-.094 2-2a3.828 3.828 0 015.414 0z\"\n  }))), \"What is Prompt-to-Voice?\"), mdx(\"p\", null, \"Prompt-to-voice is a feature that allows users to generate realistic and expressive AI voices from natural\\nlanguage prompts. A prompt is a short text that describes what kind of voice or speech you want to generate.\\nFor example:\"), mdx(\"div\", {\n    style: {\n      \"width\": \"700px\"\n    },\n    align: \"center\"\n  }, mdx(\"figcaption\", {\n    style: {\n      \"width\": \"400px\"\n    }\n  }, mdx(\"i\", null, \"An older man with a British accent and a pleasing, deep voice.\")), mdx(\"audio\", {\n    controls: true,\n    src: \"https://coqui-ai-public-data.s3.amazonaws.com/website/audio/old-british-man.wav\",\n    type: \"audio/wav\"\n  }), mdx(\"br\", null), mdx(\"br\", null), mdx(\"figcaption\", {\n    style: {\n      \"width\": \"400px\"\n    }\n  }, mdx(\"i\", null, \"A female senior with a guttural voice and an American accent. Their voice should be hoarse and have a boisterous intensity.\")), mdx(\"audio\", {\n    controls: true,\n    src: \"https://coqui-ai-public-data.s3.amazonaws.com/website/audio/old-american-woman.wav\",\n    type: \"audio/wav\"\n  }), mdx(\"br\", null), mdx(\"br\", null), mdx(\"figcaption\", {\n    style: {\n      \"width\": \"400px\"\n    }\n  }, mdx(\"i\", null, \"A female young adult with a childlike voice and an American accent. Their voice should be polished and breathy and have a ringing but feathery intensity with a calming delivery.\")), mdx(\"audio\", {\n    controls: true,\n    src: \"https://coqui-ai-public-data.s3.amazonaws.com/website/audio/young-american-female-adult.wav\",\n    type: \"audio/wav\"\n  }), mdx(\"br\", null), mdx(\"br\", null)), mdx(\"p\", null, \"By using prompts, users can easily specify the characteristics and style of desired voice. Coqui Studio\\nuses state-of-the-art generative AI technology to turn prompts into high-quality AI voices that are ready\\nfor your project.\"), mdx(\"h3\", {\n    \"id\": \"how-does-prompt-to-voice-work\",\n    \"style\": {\n      \"position\": \"relative\"\n    }\n  }, mdx(\"a\", {\n    parentName: \"h3\",\n    \"href\": \"#how-does-prompt-to-voice-work\",\n    \"aria-label\": \"how does prompt to voice work permalink\",\n    \"className\": \"anchor before\"\n  }, mdx(\"svg\", {\n    parentName: \"a\",\n    \"xmlns\": \"http://www.w3.org/2000/svg\",\n    \"width\": \"16\",\n    \"height\": \"16\",\n    \"focusable\": \"false\",\n    \"viewBox\": \"0 0 16 16\"\n  }, \"\\n  \", mdx(\"path\", {\n    parentName: \"svg\",\n    \"fill\": \"currentColor\",\n    \"d\": \"M4.441 7.38l.095.083.939.939-.708.707-.939-.939-2 2-.132.142a2.829 2.829 0 003.99 3.99l.142-.132 2-2-.939-.939.707-.708.94.94a1 1 0 01.083 1.32l-.083.094-2 2A3.828 3.828 0 01.972 9.621l.15-.158 2-2A1 1 0 014.34 7.31l.101.07zm7.413-3.234a.5.5 0 01.057.638l-.057.07-7 7a.5.5 0 01-.765-.638l.057-.07 7-7a.5.5 0 01.708 0zm3.023-3.025a3.829 3.829 0 01.15 5.257l-.15.158-2 2a1 1 0 01-1.32.083l-.094-.083-.94-.94.708-.707.939.94 2-2 .132-.142a2.829 2.829 0 00-3.99-3.99l-.142.131-2 2 .939.939-.707.708-.94-.94a1 1 0 01-.082-1.32l.083-.094 2-2a3.828 3.828 0 015.414 0z\"\n  }))), \"How Does Prompt-to-Voice Work?\"), mdx(\"p\", null, \"Prompt-to-voice works by using generative AI models that are trained on large amounts of speech data. These\\nmodels learn how to map text inputs to a space of possible voices. Then they can use this mapping to generate\\nnovel and diverse AI voices that match the input specifications.\"), mdx(\"p\", null, \"One way to understand how prompt-to-voice works is by making an analogy to image generation models like Dall-E\\nor Midjourney. These models can generate realistic and creative images from natural language prompts. Similarly,\\nprompt-to-voice can generate realistic and creative voices from natural language prompts.\"), mdx(\"h3\", {\n    \"id\": \"why-is-prompt-to-voice-useful\",\n    \"style\": {\n      \"position\": \"relative\"\n    }\n  }, mdx(\"a\", {\n    parentName: \"h3\",\n    \"href\": \"#why-is-prompt-to-voice-useful\",\n    \"aria-label\": \"why is prompt to voice useful permalink\",\n    \"className\": \"anchor before\"\n  }, mdx(\"svg\", {\n    parentName: \"a\",\n    \"xmlns\": \"http://www.w3.org/2000/svg\",\n    \"width\": \"16\",\n    \"height\": \"16\",\n    \"focusable\": \"false\",\n    \"viewBox\": \"0 0 16 16\"\n  }, \"\\n  \", mdx(\"path\", {\n    parentName: \"svg\",\n    \"fill\": \"currentColor\",\n    \"d\": \"M4.441 7.38l.095.083.939.939-.708.707-.939-.939-2 2-.132.142a2.829 2.829 0 003.99 3.99l.142-.132 2-2-.939-.939.707-.708.94.94a1 1 0 01.083 1.32l-.083.094-2 2A3.828 3.828 0 01.972 9.621l.15-.158 2-2A1 1 0 014.34 7.31l.101.07zm7.413-3.234a.5.5 0 01.057.638l-.057.07-7 7a.5.5 0 01-.765-.638l.057-.07 7-7a.5.5 0 01.708 0zm3.023-3.025a3.829 3.829 0 01.15 5.257l-.15.158-2 2a1 1 0 01-1.32.083l-.094-.083-.94-.94.708-.707.939.94 2-2 .132-.142a2.829 2.829 0 00-3.99-3.99l-.142.131-2 2 .939.939-.707.708-.94-.94a1 1 0 01-.082-1.32l.083-.094 2-2a3.828 3.828 0 015.414 0z\"\n  }))), \"Why is Prompt-to-Voice Useful?\"), mdx(\"p\", null, \"Prompt-to-voice is useful because it enables users to create unique and customized AI voices for various purposes.\\nSome of the benefits of prompt-to-voice are:\"), mdx(\"h4\", {\n    \"id\": \"creativity\",\n    \"style\": {\n      \"position\": \"relative\"\n    }\n  }, mdx(\"a\", {\n    parentName: \"h4\",\n    \"href\": \"#creativity\",\n    \"aria-label\": \"creativity permalink\",\n    \"className\": \"anchor before\"\n  }, mdx(\"svg\", {\n    parentName: \"a\",\n    \"xmlns\": \"http://www.w3.org/2000/svg\",\n    \"width\": \"16\",\n    \"height\": \"16\",\n    \"focusable\": \"false\",\n    \"viewBox\": \"0 0 16 16\"\n  }, \"\\n  \", mdx(\"path\", {\n    parentName: \"svg\",\n    \"fill\": \"currentColor\",\n    \"d\": \"M4.441 7.38l.095.083.939.939-.708.707-.939-.939-2 2-.132.142a2.829 2.829 0 003.99 3.99l.142-.132 2-2-.939-.939.707-.708.94.94a1 1 0 01.083 1.32l-.083.094-2 2A3.828 3.828 0 01.972 9.621l.15-.158 2-2A1 1 0 014.34 7.31l.101.07zm7.413-3.234a.5.5 0 01.057.638l-.057.07-7 7a.5.5 0 01-.765-.638l.057-.07 7-7a.5.5 0 01.708 0zm3.023-3.025a3.829 3.829 0 01.15 5.257l-.15.158-2 2a1 1 0 01-1.32.083l-.094-.083-.94-.94.708-.707.939.94 2-2 .132-.142a2.829 2.829 0 00-3.99-3.99l-.142.131-2 2 .939.939-.707.708-.94-.94a1 1 0 01-.082-1.32l.083-.094 2-2a3.828 3.828 0 015.414 0z\"\n  }))), \"Creativity\"), mdx(\"p\", null, \"Prompt-to-voice allows users to explore their creativity and imagination by generating voices that are not limited\\nby existing recordings or templates. Users can experiment with different combinations of attributes, styles,\\ncharacteristics, etc., and discover new possibilities for their projects.\"), mdx(\"h3\", {\n    \"id\": \"efficiency\",\n    \"style\": {\n      \"position\": \"relative\"\n    }\n  }, mdx(\"a\", {\n    parentName: \"h3\",\n    \"href\": \"#efficiency\",\n    \"aria-label\": \"efficiency permalink\",\n    \"className\": \"anchor before\"\n  }, mdx(\"svg\", {\n    parentName: \"a\",\n    \"xmlns\": \"http://www.w3.org/2000/svg\",\n    \"width\": \"16\",\n    \"height\": \"16\",\n    \"focusable\": \"false\",\n    \"viewBox\": \"0 0 16 16\"\n  }, \"\\n  \", mdx(\"path\", {\n    parentName: \"svg\",\n    \"fill\": \"currentColor\",\n    \"d\": \"M4.441 7.38l.095.083.939.939-.708.707-.939-.939-2 2-.132.142a2.829 2.829 0 003.99 3.99l.142-.132 2-2-.939-.939.707-.708.94.94a1 1 0 01.083 1.32l-.083.094-2 2A3.828 3.828 0 01.972 9.621l.15-.158 2-2A1 1 0 014.34 7.31l.101.07zm7.413-3.234a.5.5 0 01.057.638l-.057.07-7 7a.5.5 0 01-.765-.638l.057-.07 7-7a.5.5 0 01.708 0zm3.023-3.025a3.829 3.829 0 01.15 5.257l-.15.158-2 2a1 1 0 01-1.32.083l-.094-.083-.94-.94.708-.707.939.94 2-2 .132-.142a2.829 2.829 0 00-3.99-3.99l-.142.131-2 2 .939.939-.707.708-.94-.94a1 1 0 01-.082-1.32l.083-.094 2-2a3.828 3.828 0 015.414 0z\"\n  }))), \"Efficiency\"), mdx(\"p\", null, \"Prompt-to-voice saves users time and effort by generating voices instantly from text inputs. Creators do not need\\nto spend hours casting the right voice for their content and avoid fees that are attached to it.\"), mdx(\"h4\", {\n    \"id\": \"flexibility\",\n    \"style\": {\n      \"position\": \"relative\"\n    }\n  }, mdx(\"a\", {\n    parentName: \"h4\",\n    \"href\": \"#flexibility\",\n    \"aria-label\": \"flexibility permalink\",\n    \"className\": \"anchor before\"\n  }, mdx(\"svg\", {\n    parentName: \"a\",\n    \"xmlns\": \"http://www.w3.org/2000/svg\",\n    \"width\": \"16\",\n    \"height\": \"16\",\n    \"focusable\": \"false\",\n    \"viewBox\": \"0 0 16 16\"\n  }, \"\\n  \", mdx(\"path\", {\n    parentName: \"svg\",\n    \"fill\": \"currentColor\",\n    \"d\": \"M4.441 7.38l.095.083.939.939-.708.707-.939-.939-2 2-.132.142a2.829 2.829 0 003.99 3.99l.142-.132 2-2-.939-.939.707-.708.94.94a1 1 0 01.083 1.32l-.083.094-2 2A3.828 3.828 0 01.972 9.621l.15-.158 2-2A1 1 0 014.34 7.31l.101.07zm7.413-3.234a.5.5 0 01.057.638l-.057.07-7 7a.5.5 0 01-.765-.638l.057-.07 7-7a.5.5 0 01.708 0zm3.023-3.025a3.829 3.829 0 01.15 5.257l-.15.158-2 2a1 1 0 01-1.32.083l-.094-.083-.94-.94.708-.707.939.94 2-2 .132-.142a2.829 2.829 0 00-3.99-3.99l-.142.131-2 2 .939.939-.707.708-.94-.94a1 1 0 01-.082-1.32l.083-.094 2-2a3.828 3.828 0 015.414 0z\"\n  }))), \"Flexibility\"), mdx(\"p\", null, \"Prompt-to-voice gives users more control and flexibility over their voice outputs. Users can easily modify or update\\ntheir prompts according to their needs or preferences. They can also adjust parameters such as pitch, speed, volume,\\netc., to fine-tune their results once they find the voice they desire.\"), mdx(\"h3\", {\n    \"id\": \"give-it-a-try\",\n    \"style\": {\n      \"position\": \"relative\"\n    }\n  }, mdx(\"a\", {\n    parentName: \"h3\",\n    \"href\": \"#give-it-a-try\",\n    \"aria-label\": \"give it a try permalink\",\n    \"className\": \"anchor before\"\n  }, mdx(\"svg\", {\n    parentName: \"a\",\n    \"xmlns\": \"http://www.w3.org/2000/svg\",\n    \"width\": \"16\",\n    \"height\": \"16\",\n    \"focusable\": \"false\",\n    \"viewBox\": \"0 0 16 16\"\n  }, \"\\n  \", mdx(\"path\", {\n    parentName: \"svg\",\n    \"fill\": \"currentColor\",\n    \"d\": \"M4.441 7.38l.095.083.939.939-.708.707-.939-.939-2 2-.132.142a2.829 2.829 0 003.99 3.99l.142-.132 2-2-.939-.939.707-.708.94.94a1 1 0 01.083 1.32l-.083.094-2 2A3.828 3.828 0 01.972 9.621l.15-.158 2-2A1 1 0 014.34 7.31l.101.07zm7.413-3.234a.5.5 0 01.057.638l-.057.07-7 7a.5.5 0 01-.765-.638l.057-.07 7-7a.5.5 0 01.708 0zm3.023-3.025a3.829 3.829 0 01.15 5.257l-.15.158-2 2a1 1 0 01-1.32.083l-.094-.083-.94-.94.708-.707.939.94 2-2 .132-.142a2.829 2.829 0 00-3.99-3.99l-.142.131-2 2 .939.939-.707.708-.94-.94a1 1 0 01-.082-1.32l.083-.094 2-2a3.828 3.828 0 015.414 0z\"\n  }))), \"Give It a Try\"), mdx(\"div\", {\n    align: \"center\"\n  }, mdx(\"iframe\", {\n    scrolling: \"no\",\n    style: {\n      \"width\": \"700px\",\n      \"height\": \"750px\"\n    },\n    src: \"\".concat(process.env.GATSBY_BACKEND_URL, \"/widget/prompt-to-voice\")\n  })), mdx(\"p\", null, mdx(\"a\", {\n    parentName: \"p\",\n    \"href\": \"https://app.coqui.ai/auth/signup\"\n  }, \"Sign up\"), \" for Coqui Studio (you get 30 free minutes when you sign up) and start\\nusing prompt-to-voice in your next project (If you have feedback, you can find us on \", mdx(\"a\", {\n    parentName: \"p\",\n    \"href\": \"https://discord.gg/zvaJE2MHVf\"\n  }, \"Discord\"), \")\"));\n}\n;\nMDXContent.isMDXComponent = true;","tableOfContents":{"items":[{"url":"#coqui-studio-the-studio-for-generative-ai-voice","title":"Coqui Studio: The Studio for Generative AI Voice"},{"url":"#what-is-prompt-to-voice","title":"What is Prompt-to-Voice?"},{"url":"#how-does-prompt-to-voice-work","title":"How Does Prompt-to-Voice Work?"},{"url":"#why-is-prompt-to-voice-useful","title":"Why is Prompt-to-Voice Useful?"},{"url":"#efficiency","title":"Efficiency"},{"url":"#give-it-a-try","title":"Give It a Try"}]}}},"pageContext":{"frontmatter":{"title":"Introducing Prompt-to-Voice - Describe It to Hear It","name":"Eren Gölge and Kelly Davis","picture":"https://avatars.githubusercontent.com/u/75583352?s=96&v=4","date":"Feb 17, 2022"},"fileAbsolutePath":"/home/runner/work/coqui-ai.github.io/coqui-ai.github.io/src/pages/blog/tts/prompt-to-voice.mdx"}},"staticQueryHashes":["1942088059","3709355695"]}