{"componentChunkName":"component---src-pages-blog-tts-dive-deeper-into-the-world-of-xtts-mdx","path":"/blog/tts/dive_deeper_into_the_world_of_xtts","result":{"data":{"mdx":{"id":"b3f95ba1-9eb7-53e6-8028-d1accbab71e0","excerpt":"Brace yourself, game developers and tech enthusiasts! Today, we're about to delve into an\nawe-inspiring dimension of game audio design that‚Ä¶","body":"var _excluded = [\"components\"];\n\nvar _templateObject;\n\nfunction _extends() { _extends = Object.assign ? Object.assign.bind() : function (target) { for (var i = 1; i < arguments.length; i++) { var source = arguments[i]; for (var key in source) { if (Object.prototype.hasOwnProperty.call(source, key)) { target[key] = source[key]; } } } return target; }; return _extends.apply(this, arguments); }\n\nfunction _objectWithoutProperties(source, excluded) { if (source == null) return {}; var target = _objectWithoutPropertiesLoose(source, excluded); var key, i; if (Object.getOwnPropertySymbols) { var sourceSymbolKeys = Object.getOwnPropertySymbols(source); for (i = 0; i < sourceSymbolKeys.length; i++) { key = sourceSymbolKeys[i]; if (excluded.indexOf(key) >= 0) continue; if (!Object.prototype.propertyIsEnumerable.call(source, key)) continue; target[key] = source[key]; } } return target; }\n\nfunction _objectWithoutPropertiesLoose(source, excluded) { if (source == null) return {}; var target = {}; var sourceKeys = Object.keys(source); var key, i; for (i = 0; i < sourceKeys.length; i++) { key = sourceKeys[i]; if (excluded.indexOf(key) >= 0) continue; target[key] = source[key]; } return target; }\n\nfunction _taggedTemplateLiteral(strings, raw) { if (!raw) { raw = strings.slice(0); } return Object.freeze(Object.defineProperties(strings, { raw: { value: Object.freeze(raw) } })); }\n\n/* @jsxRuntime classic */\n\n/* @jsx mdx */\nvar pageQuery = graphql(_templateObject || (_templateObject = _taggedTemplateLiteral([\"\\n  query($fileAbsolutePath: String) {\\n    ...SidebarPageFragment\\n  }\\n\"])));\nvar _frontmatter = {\n  \"title\": \"Dive Deeper into the World of XTTS\",\n  \"name\": \"Team Coqui üê∏\",\n  \"picture\": \"https://avatars.githubusercontent.com/u/75583352?s=96&v=4\",\n  \"date\": \"August 2, 2023\"\n};\n\nvar makeShortcode = function makeShortcode(name) {\n  return function MDXDefaultShortcode(props) {\n    console.warn(\"Component \" + name + \" was not imported, exported, or provided by MDXProvider as global scope\");\n    return mdx(\"div\", props);\n  };\n};\n\nvar Link = makeShortcode(\"Link\");\nvar layoutProps = {\n  pageQuery: pageQuery,\n  _frontmatter: _frontmatter\n};\nvar MDXLayout = \"wrapper\";\nreturn function MDXContent(_ref) {\n  var components = _ref.components,\n      props = _objectWithoutProperties(_ref, _excluded);\n\n  return mdx(MDXLayout, _extends({}, layoutProps, props, {\n    components: components,\n    mdxType: \"MDXLayout\"\n  }), mdx(\"p\", null, \"Brace yourself, game developers and tech enthusiasts! Today, we\\u2019re about to delve into an\\nawe-inspiring dimension of game audio design that\\u2019s sure to rock your world. Our mission?\\nTo inject an unparalleled level of expressivity and realism into your beloved game\\ncharacters. The key to this thrilling evolution? XTTS, our cutting-edge Generative Voice\\nAI.\"), mdx(\"h3\", {\n    \"id\": \"embarking-on-a-new-journey\",\n    \"style\": {\n      \"position\": \"relative\"\n    }\n  }, mdx(\"a\", {\n    parentName: \"h3\",\n    \"href\": \"#embarking-on-a-new-journey\",\n    \"aria-label\": \"embarking on a new journey permalink\",\n    \"className\": \"anchor before\"\n  }, mdx(\"svg\", {\n    parentName: \"a\",\n    \"xmlns\": \"http://www.w3.org/2000/svg\",\n    \"width\": \"16\",\n    \"height\": \"16\",\n    \"focusable\": \"false\",\n    \"viewBox\": \"0 0 16 16\"\n  }, \"\\n  \", mdx(\"path\", {\n    parentName: \"svg\",\n    \"fill\": \"currentColor\",\n    \"d\": \"M4.441 7.38l.095.083.939.939-.708.707-.939-.939-2 2-.132.142a2.829 2.829 0 003.99 3.99l.142-.132 2-2-.939-.939.707-.708.94.94a1 1 0 01.083 1.32l-.083.094-2 2A3.828 3.828 0 01.972 9.621l.15-.158 2-2A1 1 0 014.34 7.31l.101.07zm7.413-3.234a.5.5 0 01.057.638l-.057.07-7 7a.5.5 0 01-.765-.638l.057-.07 7-7a.5.5 0 01.708 0zm3.023-3.025a3.829 3.829 0 01.15 5.257l-.15.158-2 2a1 1 0 01-1.32.083l-.094-.083-.94-.94.708-.707.939.94 2-2 .132-.142a2.829 2.829 0 00-3.99-3.99l-.142.131-2 2 .939.939-.707.708-.94-.94a1 1 0 01-.082-1.32l.083-.094 2-2a3.828 3.828 0 015.414 0z\"\n  }))), \"Embarking on a New Journey\"), mdx(\"p\", null, \"We\\u2019re not just stepping, but leaping ahead with XTTS. This state-of-the-art technology,\\nfueled by the revolutionary advancements in Generative Voice AI, is all set to redefine\\nthe way you perceive game audio. Think stunningly expressive outputs, superior voice\\nquality, and a new gold standard for Generative Voice AI game characters. The result?\\nNot just realistic, but phenomenally lifelike characters that immerse players in\\nbreathtakingly tangible game worlds.\"), mdx(\"div\", {\n    align: \"center\"\n  }, mdx(Link, {\n    to: \"https://app.coqui.ai/auth/signup\",\n    mdxType: \"Link\"\n  }, mdx(\"p\", null, mdx(\"span\", {\n    parentName: \"p\",\n    \"className\": \"gatsby-resp-image-wrapper\",\n    \"style\": {\n      \"position\": \"relative\",\n      \"display\": \"block\",\n      \"marginLeft\": \"auto\",\n      \"marginRight\": \"auto\",\n      \"maxWidth\": \"137px\"\n    }\n  }, \"\\n      \", mdx(\"span\", {\n    parentName: \"span\",\n    \"className\": \"gatsby-resp-image-background-image\",\n    \"style\": {\n      \"paddingBottom\": \"34.306569343065696%\",\n      \"position\": \"relative\",\n      \"bottom\": \"0\",\n      \"left\": \"0\",\n      \"display\": \"block\"\n    }\n  }), \"\\n  \", mdx(\"img\", {\n    parentName: \"span\",\n    \"className\": \"gatsby-resp-image-image\",\n    \"alt\": \"IMAGE\",\n    \"title\": \"IMAGE\",\n    \"src\": \"/static/0addc085d063dac762fd9b75a388f199/3f2c9/blog-dive_deeper_into_the_world_of_xtts-try-now-for-free.png\",\n    \"srcSet\": [\"/static/0addc085d063dac762fd9b75a388f199/3f2c9/blog-dive_deeper_into_the_world_of_xtts-try-now-for-free.png 137w\"],\n    \"sizes\": \"(max-width: 137px) 100vw, 137px\",\n    \"style\": {\n      \"width\": \"100%\",\n      \"height\": \"100%\",\n      \"margin\": \"0\",\n      \"verticalAlign\": \"middle\",\n      \"position\": \"absolute\",\n      \"top\": \"0\",\n      \"left\": \"0\"\n    },\n    \"loading\": \"lazy\"\n  }), \"\\n    \")))), mdx(\"h3\", {\n    \"id\": \"unleashing-creativity-with-coqui-studio\",\n    \"style\": {\n      \"position\": \"relative\"\n    }\n  }, mdx(\"a\", {\n    parentName: \"h3\",\n    \"href\": \"#unleashing-creativity-with-coqui-studio\",\n    \"aria-label\": \"unleashing creativity with coqui studio permalink\",\n    \"className\": \"anchor before\"\n  }, mdx(\"svg\", {\n    parentName: \"a\",\n    \"xmlns\": \"http://www.w3.org/2000/svg\",\n    \"width\": \"16\",\n    \"height\": \"16\",\n    \"focusable\": \"false\",\n    \"viewBox\": \"0 0 16 16\"\n  }, \"\\n  \", mdx(\"path\", {\n    parentName: \"svg\",\n    \"fill\": \"currentColor\",\n    \"d\": \"M4.441 7.38l.095.083.939.939-.708.707-.939-.939-2 2-.132.142a2.829 2.829 0 003.99 3.99l.142-.132 2-2-.939-.939.707-.708.94.94a1 1 0 01.083 1.32l-.083.094-2 2A3.828 3.828 0 01.972 9.621l.15-.158 2-2A1 1 0 014.34 7.31l.101.07zm7.413-3.234a.5.5 0 01.057.638l-.057.07-7 7a.5.5 0 01-.765-.638l.057-.07 7-7a.5.5 0 01.708 0zm3.023-3.025a3.829 3.829 0 01.15 5.257l-.15.158-2 2a1 1 0 01-1.32.083l-.094-.083-.94-.94.708-.707.939.94 2-2 .132-.142a2.829 2.829 0 00-3.99-3.99l-.142.131-2 2 .939.939-.707.708-.94-.94a1 1 0 01-.082-1.32l.083-.094 2-2a3.828 3.828 0 015.414 0z\"\n  }))), \"Unleashing Creativity with Coqui Studio\"), mdx(\"p\", null, \"XTTS isn\\u2019t just a tech upgrade. It\\u2019s a creative powerhouse designed to shatter the\\nconfines of your imagination. At the heart of this is the enhanced Coqui Studio,\\nyour trusty sidekick on this exciting journey.\"), mdx(\"p\", null, \"Imagine having prompt-to-voice functionality at your fingertips. One moment, you\\u2019re\\ncrafting a dialogue line for a wise-cracking wizard or a brooding cyborg, the next,\\nyou\\u2019re hearing them speak in vibrant, lifelike voices that send shivers down your\\nspine. It\\u2019s as simple as inputting your text, describing a voice, and letting\\nXTTS work its magic.\"), mdx(\"p\", null, \"Yet, the features don\\u2019t stop there. XTTS also flaunts a revolutionary voice cloning\\ncapability. Recreate the unique voice of any character, irrespective of their\\ncomplexity. From the menacing growl of a dragon to the mellifluous tones of a siren,\\nyou can breathe life into them, adding unprecedented depth and character to your\\nnarratives.\"), mdx(\"h3\", {\n    \"id\": \"crafting-captivating-audio-narratives\",\n    \"style\": {\n      \"position\": \"relative\"\n    }\n  }, mdx(\"a\", {\n    parentName: \"h3\",\n    \"href\": \"#crafting-captivating-audio-narratives\",\n    \"aria-label\": \"crafting captivating audio narratives permalink\",\n    \"className\": \"anchor before\"\n  }, mdx(\"svg\", {\n    parentName: \"a\",\n    \"xmlns\": \"http://www.w3.org/2000/svg\",\n    \"width\": \"16\",\n    \"height\": \"16\",\n    \"focusable\": \"false\",\n    \"viewBox\": \"0 0 16 16\"\n  }, \"\\n  \", mdx(\"path\", {\n    parentName: \"svg\",\n    \"fill\": \"currentColor\",\n    \"d\": \"M4.441 7.38l.095.083.939.939-.708.707-.939-.939-2 2-.132.142a2.829 2.829 0 003.99 3.99l.142-.132 2-2-.939-.939.707-.708.94.94a1 1 0 01.083 1.32l-.083.094-2 2A3.828 3.828 0 01.972 9.621l.15-.158 2-2A1 1 0 014.34 7.31l.101.07zm7.413-3.234a.5.5 0 01.057.638l-.057.07-7 7a.5.5 0 01-.765-.638l.057-.07 7-7a.5.5 0 01.708 0zm3.023-3.025a3.829 3.829 0 01.15 5.257l-.15.158-2 2a1 1 0 01-1.32.083l-.094-.083-.94-.94.708-.707.939.94 2-2 .132-.142a2.829 2.829 0 00-3.99-3.99l-.142.131-2 2 .939.939-.707.708-.94-.94a1 1 0 01-.082-1.32l.083-.094 2-2a3.828 3.828 0 015.414 0z\"\n  }))), \"Crafting Captivating Audio Narratives\"), mdx(\"p\", null, \"But why stop at character voices? XTTS empowers you to weave enchanting audio\\nnarratives. You can create not just individual voices, but entire conversational\\ndynamics, complete with nuanced emotional undertones and idiosyncratic expressions.\\nThe result? A truly immersive gaming experience that leaves players hanging on to\\nevery word, every sound, every beat of their adventure.\"), mdx(\"h3\", {\n    \"id\": \"the-invitation-to-experiment-and-explore\",\n    \"style\": {\n      \"position\": \"relative\"\n    }\n  }, mdx(\"a\", {\n    parentName: \"h3\",\n    \"href\": \"#the-invitation-to-experiment-and-explore\",\n    \"aria-label\": \"the invitation to experiment and explore permalink\",\n    \"className\": \"anchor before\"\n  }, mdx(\"svg\", {\n    parentName: \"a\",\n    \"xmlns\": \"http://www.w3.org/2000/svg\",\n    \"width\": \"16\",\n    \"height\": \"16\",\n    \"focusable\": \"false\",\n    \"viewBox\": \"0 0 16 16\"\n  }, \"\\n  \", mdx(\"path\", {\n    parentName: \"svg\",\n    \"fill\": \"currentColor\",\n    \"d\": \"M4.441 7.38l.095.083.939.939-.708.707-.939-.939-2 2-.132.142a2.829 2.829 0 003.99 3.99l.142-.132 2-2-.939-.939.707-.708.94.94a1 1 0 01.083 1.32l-.083.094-2 2A3.828 3.828 0 01.972 9.621l.15-.158 2-2A1 1 0 014.34 7.31l.101.07zm7.413-3.234a.5.5 0 01.057.638l-.057.07-7 7a.5.5 0 01-.765-.638l.057-.07 7-7a.5.5 0 01.708 0zm3.023-3.025a3.829 3.829 0 01.15 5.257l-.15.158-2 2a1 1 0 01-1.32.083l-.094-.083-.94-.94.708-.707.939.94 2-2 .132-.142a2.829 2.829 0 00-3.99-3.99l-.142.131-2 2 .939.939-.707.708-.94-.94a1 1 0 01-.082-1.32l.083-.094 2-2a3.828 3.828 0 015.414 0z\"\n  }))), \"The Invitation to Experiment and Explore\"), mdx(\"p\", null, \"Ready to push the boundaries of your game development prowess? XTTS welcomes you\\nwith open arms. Whether you\\u2019re perfecting the gravelly voice of a battle-hardened\\nspace marine or refining the accent of an enigmatic elf, XTTS allows you to\\nexperiment, iterate, and customize until you hit the sweet spot.\"), mdx(\"h3\", {\n    \"id\": \"were-listening-always\",\n    \"style\": {\n      \"position\": \"relative\"\n    }\n  }, mdx(\"a\", {\n    parentName: \"h3\",\n    \"href\": \"#were-listening-always\",\n    \"aria-label\": \"were listening always permalink\",\n    \"className\": \"anchor before\"\n  }, mdx(\"svg\", {\n    parentName: \"a\",\n    \"xmlns\": \"http://www.w3.org/2000/svg\",\n    \"width\": \"16\",\n    \"height\": \"16\",\n    \"focusable\": \"false\",\n    \"viewBox\": \"0 0 16 16\"\n  }, \"\\n  \", mdx(\"path\", {\n    parentName: \"svg\",\n    \"fill\": \"currentColor\",\n    \"d\": \"M4.441 7.38l.095.083.939.939-.708.707-.939-.939-2 2-.132.142a2.829 2.829 0 003.99 3.99l.142-.132 2-2-.939-.939.707-.708.94.94a1 1 0 01.083 1.32l-.083.094-2 2A3.828 3.828 0 01.972 9.621l.15-.158 2-2A1 1 0 014.34 7.31l.101.07zm7.413-3.234a.5.5 0 01.057.638l-.057.07-7 7a.5.5 0 01-.765-.638l.057-.07 7-7a.5.5 0 01.708 0zm3.023-3.025a3.829 3.829 0 01.15 5.257l-.15.158-2 2a1 1 0 01-1.32.083l-.094-.083-.94-.94.708-.707.939.94 2-2 .132-.142a2.829 2.829 0 00-3.99-3.99l-.142.131-2 2 .939.939-.707.708-.94-.94a1 1 0 01-.082-1.32l.083-.094 2-2a3.828 3.828 0 015.414 0z\"\n  }))), \"We\\u2019re Listening, Always\"), mdx(\"p\", null, \"But our journey with XTTS isn\\u2019t a monologue; it\\u2019s a conversation. As you explore the\\npossibilities, we\\u2019re eager to hear your feedback, answer your questions, and\\nconstantly enhance your experience. Remember, each comment, each query, each idea\\npropels us forward on our shared mission: to take game audio to unparalleled heights.\"), mdx(\"p\", null, \"To sum up, XTTS isn\\u2019t just a Generative Voice AI; it\\u2019s a groundbreaking tool designed\\nto transform your games into living, breathing universes. So why wait? Step into the\\nfuture of game audio design today, and let your characters come alive like never\\nbefore!\"), mdx(\"div\", {\n    align: \"center\"\n  }, mdx(Link, {\n    to: \"https://app.coqui.ai/auth/signup\",\n    mdxType: \"Link\"\n  }, mdx(\"p\", null, mdx(\"span\", {\n    parentName: \"p\",\n    \"className\": \"gatsby-resp-image-wrapper\",\n    \"style\": {\n      \"position\": \"relative\",\n      \"display\": \"block\",\n      \"marginLeft\": \"auto\",\n      \"marginRight\": \"auto\",\n      \"maxWidth\": \"137px\"\n    }\n  }, \"\\n      \", mdx(\"span\", {\n    parentName: \"span\",\n    \"className\": \"gatsby-resp-image-background-image\",\n    \"style\": {\n      \"paddingBottom\": \"34.306569343065696%\",\n      \"position\": \"relative\",\n      \"bottom\": \"0\",\n      \"left\": \"0\",\n      \"display\": \"block\"\n    }\n  }), \"\\n  \", mdx(\"img\", {\n    parentName: \"span\",\n    \"className\": \"gatsby-resp-image-image\",\n    \"alt\": \"IMAGE\",\n    \"title\": \"IMAGE\",\n    \"src\": \"/static/0addc085d063dac762fd9b75a388f199/3f2c9/blog-dive_deeper_into_the_world_of_xtts-try-now-for-free.png\",\n    \"srcSet\": [\"/static/0addc085d063dac762fd9b75a388f199/3f2c9/blog-dive_deeper_into_the_world_of_xtts-try-now-for-free.png 137w\"],\n    \"sizes\": \"(max-width: 137px) 100vw, 137px\",\n    \"style\": {\n      \"width\": \"100%\",\n      \"height\": \"100%\",\n      \"margin\": \"0\",\n      \"verticalAlign\": \"middle\",\n      \"position\": \"absolute\",\n      \"top\": \"0\",\n      \"left\": \"0\"\n    },\n    \"loading\": \"lazy\"\n  }), \"\\n    \")))));\n}\n;\nMDXContent.isMDXComponent = true;","tableOfContents":{"items":[{"url":"#embarking-on-a-new-journey","title":"Embarking on a New Journey"},{"url":"#unleashing-creativity-with-coqui-studio","title":"Unleashing Creativity with Coqui Studio"},{"url":"#crafting-captivating-audio-narratives","title":"Crafting Captivating Audio Narratives"},{"url":"#the-invitation-to-experiment-and-explore","title":"The Invitation to Experiment and Explore"},{"url":"#were-listening-always","title":"We're Listening, Always"}]}}},"pageContext":{"frontmatter":{"title":"Dive Deeper into the World of XTTS","name":"Team Coqui üê∏","picture":"https://avatars.githubusercontent.com/u/75583352?s=96&v=4","date":"August 2, 2023"},"fileAbsolutePath":"/home/runner/work/coqui-ai.github.io/coqui-ai.github.io/src/pages/blog/tts/dive_deeper_into_the_world_of_xtts.mdx"}},"staticQueryHashes":["1942088059","3709355695"]}