{"componentChunkName":"component---src-pages-blog-tts-xtts-taking-tts-to-the-next-level-mdx","path":"/blog/tts/xtts_taking_tts_to_the_next_level","result":{"data":{"mdx":{"id":"8f8a928a-850b-5613-8a67-0837a653d5c6","excerpt":"Introduction Voice acting plays a crucial role in the success of video games. The quality of a game's voice over\nsignificantly impacts a…","body":"var _excluded = [\"components\"];\n\nvar _templateObject;\n\nfunction _extends() { _extends = Object.assign ? Object.assign.bind() : function (target) { for (var i = 1; i < arguments.length; i++) { var source = arguments[i]; for (var key in source) { if (Object.prototype.hasOwnProperty.call(source, key)) { target[key] = source[key]; } } } return target; }; return _extends.apply(this, arguments); }\n\nfunction _objectWithoutProperties(source, excluded) { if (source == null) return {}; var target = _objectWithoutPropertiesLoose(source, excluded); var key, i; if (Object.getOwnPropertySymbols) { var sourceSymbolKeys = Object.getOwnPropertySymbols(source); for (i = 0; i < sourceSymbolKeys.length; i++) { key = sourceSymbolKeys[i]; if (excluded.indexOf(key) >= 0) continue; if (!Object.prototype.propertyIsEnumerable.call(source, key)) continue; target[key] = source[key]; } } return target; }\n\nfunction _objectWithoutPropertiesLoose(source, excluded) { if (source == null) return {}; var target = {}; var sourceKeys = Object.keys(source); var key, i; for (i = 0; i < sourceKeys.length; i++) { key = sourceKeys[i]; if (excluded.indexOf(key) >= 0) continue; target[key] = source[key]; } return target; }\n\nfunction _taggedTemplateLiteral(strings, raw) { if (!raw) { raw = strings.slice(0); } return Object.freeze(Object.defineProperties(strings, { raw: { value: Object.freeze(raw) } })); }\n\n/* @jsxRuntime classic */\n\n/* @jsx mdx */\nvar pageQuery = graphql(_templateObject || (_templateObject = _taggedTemplateLiteral([\"\\n  query($fileAbsolutePath: String) {\\n    ...SidebarPageFragment\\n  }\\n\"])));\nvar _frontmatter = {\n  \"title\": \"XTTS: Taking TTS to the Next Level\",\n  \"name\": \"Eren Gölge and Kelly Davis\",\n  \"picture\": \"https://avatars.githubusercontent.com/u/75583352?s=96&v=4\",\n  \"date\": \"Jun 14, 2023\"\n};\nvar layoutProps = {\n  pageQuery: pageQuery,\n  _frontmatter: _frontmatter\n};\nvar MDXLayout = \"wrapper\";\nreturn function MDXContent(_ref) {\n  var components = _ref.components,\n      props = _objectWithoutProperties(_ref, _excluded);\n\n  return mdx(MDXLayout, _extends({}, layoutProps, props, {\n    components: components,\n    mdxType: \"MDXLayout\"\n  }), mdx(\"h3\", {\n    \"id\": \"introduction\",\n    \"style\": {\n      \"position\": \"relative\"\n    }\n  }, mdx(\"a\", {\n    parentName: \"h3\",\n    \"href\": \"#introduction\",\n    \"aria-label\": \"introduction permalink\",\n    \"className\": \"anchor before\"\n  }, mdx(\"svg\", {\n    parentName: \"a\",\n    \"xmlns\": \"http://www.w3.org/2000/svg\",\n    \"width\": \"16\",\n    \"height\": \"16\",\n    \"focusable\": \"false\",\n    \"viewBox\": \"0 0 16 16\"\n  }, \"\\n  \", mdx(\"path\", {\n    parentName: \"svg\",\n    \"fill\": \"currentColor\",\n    \"d\": \"M4.441 7.38l.095.083.939.939-.708.707-.939-.939-2 2-.132.142a2.829 2.829 0 003.99 3.99l.142-.132 2-2-.939-.939.707-.708.94.94a1 1 0 01.083 1.32l-.083.094-2 2A3.828 3.828 0 01.972 9.621l.15-.158 2-2A1 1 0 014.34 7.31l.101.07zm7.413-3.234a.5.5 0 01.057.638l-.057.07-7 7a.5.5 0 01-.765-.638l.057-.07 7-7a.5.5 0 01.708 0zm3.023-3.025a3.829 3.829 0 01.15 5.257l-.15.158-2 2a1 1 0 01-1.32.083l-.094-.083-.94-.94.708-.707.939.94 2-2 .132-.142a2.829 2.829 0 00-3.99-3.99l-.142.131-2 2 .939.939-.707.708-.94-.94a1 1 0 01-.082-1.32l.083-.094 2-2a3.828 3.828 0 015.414 0z\"\n  }))), \"Introduction\"), mdx(\"p\", null, \"Voice acting plays a crucial role in the success of video games. The quality of a game\\u2019s voice over\\nsignificantly impacts a player\\u2019s overall experience.\"), mdx(\"p\", null, \"Game developers have long relied on text-to-speech (TTS) technology to make the characters sound more\\nrealistic and engaging. However, until now, most TTS technology has been limited, unable to produce\\nexpressive and natural-sounding voices. However, this is all about to change.\"), mdx(\"p\", null, \"Today, we\\u2019re excited to announce the launch of XTTS, a new TTS technology explicitly designed for game\\ndevelopers. XTTS delivers the most expressive and realistic TTS performances, taking game audio to the\\nnext level. \", mdx(\"a\", {\n    parentName: \"p\",\n    \"href\": \"https://docs.coqui.ai/docs#xtts\"\n  }, \"Try it out now through our API\"), \", or just hear the\\ndifference:\"), mdx(\"div\", {\n    align: \"center\"\n  }, mdx(\"iframe\", {\n    style: {\n      \"width\": \"640px\",\n      \"height\": \"360px\",\n      \"borderWidth\": \"0px 0px 0px 0px\",\n      \"borderStyle\": \"solid solid solid solid\",\n      \"borderColor\": \"black black black black\"\n    },\n    src: \"https://youtube.com/embed/TbgzSOgM-p0?autoplay=1&loop=1&playlist=TbgzSOgM-p0\",\n    allow: \"accelerometer; autoplay; encrypted-media; gyroscope; picture-in-picture\",\n    allowFullScreen: true\n  })), mdx(\"h3\", {\n    \"id\": \"research\",\n    \"style\": {\n      \"position\": \"relative\"\n    }\n  }, mdx(\"a\", {\n    parentName: \"h3\",\n    \"href\": \"#research\",\n    \"aria-label\": \"research permalink\",\n    \"className\": \"anchor before\"\n  }, mdx(\"svg\", {\n    parentName: \"a\",\n    \"xmlns\": \"http://www.w3.org/2000/svg\",\n    \"width\": \"16\",\n    \"height\": \"16\",\n    \"focusable\": \"false\",\n    \"viewBox\": \"0 0 16 16\"\n  }, \"\\n  \", mdx(\"path\", {\n    parentName: \"svg\",\n    \"fill\": \"currentColor\",\n    \"d\": \"M4.441 7.38l.095.083.939.939-.708.707-.939-.939-2 2-.132.142a2.829 2.829 0 003.99 3.99l.142-.132 2-2-.939-.939.707-.708.94.94a1 1 0 01.083 1.32l-.083.094-2 2A3.828 3.828 0 01.972 9.621l.15-.158 2-2A1 1 0 014.34 7.31l.101.07zm7.413-3.234a.5.5 0 01.057.638l-.057.07-7 7a.5.5 0 01-.765-.638l.057-.07 7-7a.5.5 0 01.708 0zm3.023-3.025a3.829 3.829 0 01.15 5.257l-.15.158-2 2a1 1 0 01-1.32.083l-.094-.083-.94-.94.708-.707.939.94 2-2 .132-.142a2.829 2.829 0 00-3.99-3.99l-.142.131-2 2 .939.939-.707.708-.94-.94a1 1 0 01-.082-1.32l.083-.094 2-2a3.828 3.828 0 015.414 0z\"\n  }))), \"Research\"), mdx(\"p\", null, \"XTTS is a new technology inspired by the latest developments in the Generative AI space. XTTS has very\\nexpressive outputs, better voice cloning, and delivers all the enhanced Coqui Studio features.\\nIt\\u2019s next level! This new technology is designed specifically for game developers who want their\\ncharacters to sound more realistic and captivating.\"), mdx(\"p\", null, \"XTTS takes inspiration from large language models but focuses on delivering exceptional TTS performance.\\nIt is compatible with Coqui Studio \\uD83D\\uDC38, including prompt-to-voice and voice cloning. Furthermore, XTTS\\nboasts superior voice cloning, enhanced studio capabilities, and improved prompt-to-voice performance\\nrelative to its predecessors.\"), mdx(\"p\", null, \"With XTTS, game developers can now create more realistic and expressive voices for their characters.\"), mdx(\"h3\", {\n    \"id\": \"limitations\",\n    \"style\": {\n      \"position\": \"relative\"\n    }\n  }, mdx(\"a\", {\n    parentName: \"h3\",\n    \"href\": \"#limitations\",\n    \"aria-label\": \"limitations permalink\",\n    \"className\": \"anchor before\"\n  }, mdx(\"svg\", {\n    parentName: \"a\",\n    \"xmlns\": \"http://www.w3.org/2000/svg\",\n    \"width\": \"16\",\n    \"height\": \"16\",\n    \"focusable\": \"false\",\n    \"viewBox\": \"0 0 16 16\"\n  }, \"\\n  \", mdx(\"path\", {\n    parentName: \"svg\",\n    \"fill\": \"currentColor\",\n    \"d\": \"M4.441 7.38l.095.083.939.939-.708.707-.939-.939-2 2-.132.142a2.829 2.829 0 003.99 3.99l.142-.132 2-2-.939-.939.707-.708.94.94a1 1 0 01.083 1.32l-.083.094-2 2A3.828 3.828 0 01.972 9.621l.15-.158 2-2A1 1 0 014.34 7.31l.101.07zm7.413-3.234a.5.5 0 01.057.638l-.057.07-7 7a.5.5 0 01-.765-.638l.057-.07 7-7a.5.5 0 01.708 0zm3.023-3.025a3.829 3.829 0 01.15 5.257l-.15.158-2 2a1 1 0 01-1.32.083l-.094-.083-.94-.94.708-.707.939.94 2-2 .132-.142a2.829 2.829 0 00-3.99-3.99l-.142.131-2 2 .939.939-.707.708-.94-.94a1 1 0 01-.082-1.32l.083-.094 2-2a3.828 3.828 0 015.414 0z\"\n  }))), \"Limitations\"), mdx(\"p\", null, \"XTTS, while highly advanced, is slower than our core TTS technology. (XTTS takes more time, but produces\\nhigher quality results!) Nevertheless, we will continue to make our core TTS technology available for\\nreal-time use cases, as well as for our open-source users. It is still state-of-the-art when considering\\nthe trade-off between speed and quality.\"), mdx(\"h3\", {\n    \"id\": \"future-work\",\n    \"style\": {\n      \"position\": \"relative\"\n    }\n  }, mdx(\"a\", {\n    parentName: \"h3\",\n    \"href\": \"#future-work\",\n    \"aria-label\": \"future work permalink\",\n    \"className\": \"anchor before\"\n  }, mdx(\"svg\", {\n    parentName: \"a\",\n    \"xmlns\": \"http://www.w3.org/2000/svg\",\n    \"width\": \"16\",\n    \"height\": \"16\",\n    \"focusable\": \"false\",\n    \"viewBox\": \"0 0 16 16\"\n  }, \"\\n  \", mdx(\"path\", {\n    parentName: \"svg\",\n    \"fill\": \"currentColor\",\n    \"d\": \"M4.441 7.38l.095.083.939.939-.708.707-.939-.939-2 2-.132.142a2.829 2.829 0 003.99 3.99l.142-.132 2-2-.939-.939.707-.708.94.94a1 1 0 01.083 1.32l-.083.094-2 2A3.828 3.828 0 01.972 9.621l.15-.158 2-2A1 1 0 014.34 7.31l.101.07zm7.413-3.234a.5.5 0 01.057.638l-.057.07-7 7a.5.5 0 01-.765-.638l.057-.07 7-7a.5.5 0 01.708 0zm3.023-3.025a3.829 3.829 0 01.15 5.257l-.15.158-2 2a1 1 0 01-1.32.083l-.094-.083-.94-.94.708-.707.939.94 2-2 .132-.142a2.829 2.829 0 00-3.99-3.99l-.142.131-2 2 .939.939-.707.708-.94-.94a1 1 0 01-.082-1.32l.083-.094 2-2a3.828 3.828 0 015.414 0z\"\n  }))), \"Future Work\"), mdx(\"p\", null, \"In the upcoming months, we will be introducing Coqui Studio integration of XTTS, adding new languages\\nto our platform, speeding up XTTS, and further improving its performance. Stay tuned for more information\\non the upcoming language updates. In the meantime, please \", mdx(\"a\", {\n    href: \"mailto:info@coqui.ai?subject=XTTS Languages\"\n  }, \"let us know\"), \"\\nif you have a particular language in mind that you would like us to prioritize.\"), mdx(\"h3\", {\n    \"id\": \"ending-words\",\n    \"style\": {\n      \"position\": \"relative\"\n    }\n  }, mdx(\"a\", {\n    parentName: \"h3\",\n    \"href\": \"#ending-words\",\n    \"aria-label\": \"ending words permalink\",\n    \"className\": \"anchor before\"\n  }, mdx(\"svg\", {\n    parentName: \"a\",\n    \"xmlns\": \"http://www.w3.org/2000/svg\",\n    \"width\": \"16\",\n    \"height\": \"16\",\n    \"focusable\": \"false\",\n    \"viewBox\": \"0 0 16 16\"\n  }, \"\\n  \", mdx(\"path\", {\n    parentName: \"svg\",\n    \"fill\": \"currentColor\",\n    \"d\": \"M4.441 7.38l.095.083.939.939-.708.707-.939-.939-2 2-.132.142a2.829 2.829 0 003.99 3.99l.142-.132 2-2-.939-.939.707-.708.94.94a1 1 0 01.083 1.32l-.083.094-2 2A3.828 3.828 0 01.972 9.621l.15-.158 2-2A1 1 0 014.34 7.31l.101.07zm7.413-3.234a.5.5 0 01.057.638l-.057.07-7 7a.5.5 0 01-.765-.638l.057-.07 7-7a.5.5 0 01.708 0zm3.023-3.025a3.829 3.829 0 01.15 5.257l-.15.158-2 2a1 1 0 01-1.32.083l-.094-.083-.94-.94.708-.707.939.94 2-2 .132-.142a2.829 2.829 0 00-3.99-3.99l-.142.131-2 2 .939.939-.707.708-.94-.94a1 1 0 01-.082-1.32l.083-.094 2-2a3.828 3.828 0 015.414 0z\"\n  }))), \"Ending Words\"), mdx(\"p\", null, \"XTTS is a game-changer for game developers. Creating realistic and expressive voices for characters,\\nXTTS is more human than human. With its advanced features and capabilities, XTTS delivers the best\\nTTS performance for game development. We encourage you to\\n\", mdx(\"a\", {\n    parentName: \"p\",\n    \"href\": \"https://docs.coqui.ai/docs#xtts\"\n  }, \"try out XTTS through our API\"), \"\\nand let us know your thoughts.\"));\n}\n;\nMDXContent.isMDXComponent = true;","tableOfContents":{"items":[{"url":"#introduction","title":"Introduction"},{"url":"#research","title":"Research"},{"url":"#limitations","title":"Limitations"},{"url":"#future-work","title":"Future Work"},{"url":"#ending-words","title":"Ending Words"}]}}},"pageContext":{"frontmatter":{"title":"XTTS: Taking TTS to the Next Level","name":"Eren Gölge and Kelly Davis","picture":"https://avatars.githubusercontent.com/u/75583352?s=96&v=4","date":"Jun 14, 2023"},"fileAbsolutePath":"/home/runner/work/coqui-ai.github.io/coqui-ai.github.io/src/pages/blog/tts/xtts_taking_tts_to_the_next_level.mdx"}},"staticQueryHashes":["1942088059","3709355695"]}